2019,11,Total IPC,02210100,"Cigarrillos, tabaco y derivados",113.32,0.31,13.32,14.23,0.0,0.02,nd,,,,,,,,,,,,
2019,11,Total IPC,03120100,Prendas De Vestir Para Hombre,101.26,0.25,1.26,1.4,0.0,0.01,nd,,,,,,,,,,,,
2019,11,Total IPC,03120200,Prendas De Vestir Para Mujer,99.2,0.14,-0.8,-0.85,0.0,-0.01,nd,,,,,,,,,,,,
2019,11,Total IPC,03120500,Prendas De Vestir Para Bebés,101.68,-0.05,1.68,1.86,0.0,0.0,nd,,,,,,,,,,,,
2019,11,Total IPC,03120600,Uniformes,103.78,0.0,3.78,3.78,0.0,0.01,nd,,,,,,,,,,,,
2019,11,Total IPC,03120700,Prendas de vestir para niña y niño,100.55,-0.05,0.55,0.79,0.0,0.0,nd,,,,,,,,,,,,
2019,11,Total IPC,03131000,"Otros artículos y accesorios de vestir para hombre y mujer, incluyendo artículos de vestir para adulto y bebé y materiales",101.5,0.1,1.5,1.49,0.0,0.0,nd,,,,,,,,,,,,
2019,11,Total IPC,03140200,Lavado Y Planchado De Ropa,103.52,0.06,3.52,4.21,0.0,0.0,nd,,,,,,,,,,,,
2019,11,Total IPC,03210100,Calzado Para Hombre,100.15,0.2,0.15,0.1,0.0,0.0,nd,,,,,,,,,,,,
2019,11,Total IPC,03210200,Calzado Para Mujer,100.57,-0.06,0.57,0.53,0.0,0.0,nd,,,,,,,,,,,,
2019,11,Total IPC,03210700,Calzado para niño y niña,100.28,-0.02,0.28,0.51,0.0,0.0,nd,,,,,,,,,,,,
2019,11,Total IPC,04130100,Arriendo efectivo ,102.51,0.13,2.51,2.75,0.01,0.27,nd,,,,,,,,,,,,
2019,11,Total IPC,04230100,Arriendo imputado,102.55,0.15,2.55,2.76,0.02,0.37,nd,,,,,,,,,,,,
2019,11,Total IPC,04310100,Materiales Para La Conservación Y La Reparación De La Vivienda,101.59,0.16,1.59,nd,0.0,0.0,nd,,,,,,,,,,,,
2019,11,Total IPC,04410100,Suministro De Agua,104.44,0.1,4.44,4.96,0.0,0.08,nd,,,,,,,,,,,,
2019,11,Total IPC,04420100,Recogida De Basuras,109.5,0.27,9.5,10.04,0.0,0.04,nd,,,,,,,,,,,,
2019,11,Total IPC,04430100,Alcantarillado,110.19,0.08,10.19,10.74,0.0,0.05,nd,,,,,,,,,,,,
2019,11,Total IPC,04440100,Servicios Relacionados Con La Copropiedad,105.79,0.07,5.79,5.84,0.0,0.07,nd,,,,,,,,,,,,
2019,11,Total IPC,04510100,Electricidad,104.61,1.25,4.61,5.48,0.04,0.14,nd,,,,,,,,,,,,
2019,11,Total IPC,04520300,Gas,106.26,2.21,6.26,6.95,0.02,0.06,nd,,,,,,,,,,,,
2019,11,Total IPC,05110100,Muebles,101.45,0.13,1.45,nd,0.0,0.01,nd,,,,,,,,,,,,
2019,11,Total IPC,05110200,Equipo De Iluminación,101.66,0.16,1.66,nd,0.0,0.0,nd,,,,,,,,,,,,
2019,11,Total IPC,05119900,Otros Artículos De Decoración,99.56,2.48,-0.44,nd,0.0,0.0,nd,,,,,,,,,,,,
2019,11,Total IPC,05210200,Ropa confeccionada para cama,101.72,0.15,1.72,1.8,0.0,0.0,nd,,,,,,,,,,,,
2019,11,Total IPC,05210700,Ropa de tocador y productos textiles del hogar,102.29,0.14,2.29,2.27,0.0,0.0,nd,,,,,,,,,,,,
2019,11,Total IPC,05310100,"Neveras, Refrigeradores Y Congeladores",103.45,-0.06,3.45,3.3,0.0,0.01,nd,,,,,,,,,,,,
2019,11,Total IPC,05310200,"Lavadoras, Secadoras Y Lava-Vajillas",103.55,0.55,3.55,2.91,0.0,0.0,nd,,,,,,,,,,,,
2019,11,Total IPC,05310300,"Estufas, Hornos Y Pipetas De Gas",103.6,0.29,3.6,3.32,0.0,0.0,nd,,,,,,,,,,,,
2019,11,Total IPC,05320100,Aparatos Eléctricos  Pequeños Para El Hogar,101.03,0.01,1.03,nd,0.0,0.0,nd,,,,,,,,,,,,
2019,11,Total IPC,05410100,"Cristalería y vajilla Artículos, vajillas y utensilios de vidrio, cristal, porcelana y cerámica para el hogar",102.84,-0.21,2.84,2.59,0.0,0.0,nd,,,,,,,,,,,,
2019,11,Total IPC,05410300,Utensilios de cocina y menaje no eléctricos,101.82,0.37,1.82,1.8,0.0,0.0,nd,,,,,,,,,,,,
2019,11,Total IPC,05520300,Accesorios Eléctricos Pequeños,98.52,0.53,-1.48,-1.41,0.0,0.0,nd,,,,,,,,,,,,
2019,11,Total IPC,05610100,Productos De Limpieza Y Mantenimiento,102.06,0.08,2.06,2.13,0.0,0.03,nd,,,,,,,,,,,,
2019,11,Total IPC,05610200,Elementos De Aseo,103.75,-0.19,3.75,3.58,0.0,0.01,nd,,,,,,,,,,,,
2019,11,Total IPC,05610400,"Artículos De Ferretería: Puntillas, Clavos, Tornillos, Tuercas, Brocas, Brochas, Pinceles, Lijas Y Otros.",102.4,0.2,2.4,nd,0.0,0.0,nd,,,,,,,,,,,,
2019,11,Total IPC,05610600,Productos desechables y no duraderos para el hogar,101.77,0.16,1.77,nd,0.0,0.0,nd,,,,,,,,,,,,
2019,11,Total IPC,05620100,Servicio Doméstico,103.74,0.04,3.74,3.78,0.0,0.04,nd,,,,,,,,,,,,
2019,11,Total IPC,06110300,Productos farmacéuticos y dermatológicos,102.79,0.31,2.79,2.83,0.0,0.03,nd,,,,,,,,,,,,
2019,11,Total IPC,06120100,Elementos Implementos Médicos,102.34,0.32,2.34,nd,0.0,0.0,nd,,,,,,,,,,,,
2019,11,Total IPC,06130100,Artefactos Y Equipo Terapéutico Y Su Reparación,102.71,0.14,2.71,3,0.0,0.0,nd,,,,,,,,,,,,
2019,11,Total IPC,06210100,Consulta Médica General Con Médico Particular,103.9,-0.07,3.9,4.39,0.0,0.0,nd,,,,,,,,,,,,
2019,11,Total IPC,06210500,"Consulta médica con médico especialista particular (incluye ortodoncia): pediatría, oftalmología, ginecología, siquiatría, traumatología, cardiología y otros especialistas",103.15,0.11,3.15,3.47,0.0,0.01,nd,,,,,,,,,,,,
2019,11,Total IPC,06220100,"Servicios Odontológicos Con Odontólogos Particulares: Consultas, Profilaxis, Exodoncias (Extracción), Amalgamas, Sellantes, Fluorización.",102.31,0.0,2.31,2.79,0.0,0.0,nd,,,,,,,,,,,,
2019,11,Total IPC,06230100,"Servicios Para Particulares En Centros De Rayos X: Radiografías (Incluyendo Las Dentales), Urografías, Mamografías, Electrocardiogramas Y Otras Imágenes Diagnósticas",102.07,0.0,2.07,2.23,0.0,0.0,nd,,,,,,,,,,,,
2019,11,Total IPC,06230200,"Exámenes De Laboratorio Para Particulares: De Sangre, Bacteriológicos, Etc.",102.26,0.14,2.26,2.36,0.0,0.0,nd,,,,,,,,,,,,
2019,11,Total IPC,06230300,Servicios Médicos Auxiliares No Hospitalarios,101.53,0.0,1.53,nd,0.0,0.0,nd,,,,,,,,,,,,
2019,11,Total IPC,06310300,"Servicios médicos menores (pequeña cirugía, cirugía ambulatoria, urgencias, etc.)",99.87,0.0,-0.13,-0.08,0.0,0.0,nd,,,,,,,,,,,,
2019,11,Total IPC,07110100,Vehículo Particular Nuevo O Usado,102.69,0.19,2.69,2.77,0.01,0.07,nd,,,,,,,,,,,,
2019,11,Total IPC,07120100,Motos Y Bicicletas Con Motor Nuevas O Usadas,105.27,0.46,5.27,5.53,0.0,0.01,nd,,,,,,,,,,,,
2019,11,Total IPC,07130100,Compra De Bicicletas Nuevas O Usadas (Excepto Para Niños),101.9,0.26,1.9,2.12,0.0,0.0,nd,,,,,,,,,,,,
2019,11,Total IPC,07210100,"Llantas Y Neumáticos, Rines Para Vehículo",106.93,0.66,6.93,7.12,0.0,0.01,nd,,,,,,,,,,,,
2019,11,Total IPC,07210300,"Productos Para La Limpieza Y Conservación Del  Vehículo: Pintura, Limpiadores, Selladores, Shampoo, Ceras, Ambientadores, Eliminador De Olores, Pañitos Húmedos Para Vehículos, Etc.",106.35,0.13,6.35,nd,0.0,0.0,nd,,,,,,,,,,,,
2019,11,Total IPC,07210600,"Piezas Para Bicicleta: Llantas, Neumáticos, Rines, Manzanas, Cadenas, Cambios, Piñones, Guallas, Sillines, Candados Y Cable Candado, Luces, Etc.",106.42,0.76,6.42,nd,0.0,0.0,nd,,,,,,,,,,,,
2019,11,Total IPC,07219900,Otras Piezas De Repuesto Para Vehículo,104.98,0.16,4.98,5.27,0.0,0.01,nd,,,,,,,,,,,,
2019,11,Total IPC,07220400,"Aditivos, Valvulinas, Líquido Para Frenos, Refrigerantes, Agua Para Batería, Etc.",103.2,0.11,3.2,nd,0.0,0.0,nd,,,,,,,,,,,,
2019,11,Total IPC,07220500,Combustibles para vehículos,101.85,-0.04,1.85,1.97,0.0,0.05,nd,,,,,,,,,,,,
2019,11,Total IPC,07230100,"Mantenimiento Y Reparaciones Efectuadas En El Taller: Engrase, Sincronización, Revisiones Técnicas, Instalaciones De Partes Y Accesorios, Balanceo De Ruedas, Despinchada, Lavado Y Polichado, Servicios De Grúa, Etc.",102.12,-0.09,2.12,2.19,0.0,0.01,nd,,,,,,,,,,,,
2019,11,Total IPC,07230200,Compra Y Cambio De Aceite,104.23,0.36,4.23,4.35,0.0,0.01,nd,,,,,,,,,,,,
2019,11,Total IPC,07230300,Servicios De Latonería Y Pintura,105.53,-0.08,5.53,nd,0.0,0.0,nd,,,,,,,,,,,,
2019,11,Total IPC,07240100,Parqueaderos,103.06,0.15,3.06,3.39,0.0,0.01,nd,,,,,,,,,,,,
2019,11,Total IPC,07240200,Peajes,102.95,0.0,2.95,nd,0.0,0.0,nd,,,,,,,,,,,,
2019,11,Total IPC,07240300,"Gastos Reglamentarios Relacionados Con La Propiedad, Manejo Y Alquiler De Vehículos",105.31,0.0,5.31,nd,0.0,0.01,nd,,,,,,,,,,,,
2019,11,Total IPC,07330100,Transporte De Pasajeros Y Equipaje En Avión (Incluye Pagos Por Exceso De Equipaje),100.9,0.23,0.9,3.03,0.0,0.0,nd,,,,,,,,,,,,
2019,11,Total IPC,07371000,Transporte urbano  (incluye tren y metro),104.21,0.07,4.21,4.25,0.0,0.19,nd,,,,,,,,,,,,
2019,11,Total IPC,07372000,"Transporte intermunicipal, interveredal e interIPC",90.41,0.84,-9.59,-5,0.0,-0.03,nd,,,,,,,,,,,,
2019,11,Total IPC,07373000,Transporte escolar,105.39,0.0,5.39,5.39,0.0,0.02,nd,,,,,,,,,,,,
2019,11,Total IPC,08210200,"Equipos de telefonía móvil, similares y reparación",90.11,-0.75,-9.89,-12.83,0.0,-0.04,nd,,,,,,,,,,,,
2019,11,Total IPC,08310400,Servicios de comunicación fija y móvil y provisión a internet,102.84,0.0,2.84,2.85,0.0,0.11,nd,,,,,,,,,,,,
2019,11,Total IPC,09110100,"Equipo Para La Recepción, Grabación Y Reproducción De Sonido Únicamente",97.67,-0.35,-2.33,-1.84,0.0,0.0,nd,,,,,,,,,,,,
2019,11,Total IPC,09110200,"Equipo Para La Grabación, Recepción Y Reproducción  De Imagen Y Sonido",95.36,0.02,-4.64,-6.3,0.0,-0.01,nd,,,,,,,,,,,,
2019,11,Total IPC,09130100,Aparatos De Procesamiento De Información Y Hardware,95.35,-0.23,-4.65,-5.19,0.0,-0.01,nd,,,,,,,,,,,,
2019,11,Total IPC,09310200,Juegos Y Juguetes Infantiles,100.83,-0.14,0.83,nd,0.0,0.0,nd,,,,,,,,,,,,
2019,11,Total IPC,09310300,"Artículos, Adornos Y Prendas De Vestir Para Fiestas",101.96,0.16,1.96,nd,0.0,0.0,nd,,,,,,,,,,,,
2019,11,Total IPC,09330200,"Plantas Naturales: Ramos De Flores, Matas, Arbustos",102.08,0.39,2.08,2.25,0.0,0.0,nd,,,,,,,,,,,,
2019,11,Total IPC,09340200,Alimentos Para Animales Domésticos Y Mascotas,104.79,-0.93,4.79,4.97,0.0,0.01,nd,,,,,,,,,,,,
2019,11,Total IPC,09340300,"Productos  Para Animales Domésticos Y Mascotas, Productos De Veterinaria, Artículos Para El Cuidado E Higiene (Shampoo, Jabón, Desodorantes) Y Accesorios Para Mascotas (Collares, Perrera, Jaula, Acuarios Y Otros)",102.82,0.24,2.82,nd,0.0,0.0,nd,,,,,,,,,,,,
2019,11,Total IPC,09350100,"Servicios De Veterinaria Y De Otro Tipo Para Animales Domésticos: Cuidado, Salón De Belleza, Alojamiento, Entrenamiento, Paseadores De Perros Y Colegios Para Mascotas Etc.",104.57,0.27,4.57,4.67,0.0,0.0,nd,,,,,,,,,,,,
2019,11,Total IPC,09410100,Servicios Recreativos,102.1,0.08,2.1,3.99,0.0,0.0,nd,,,,,,,,,,,,
2019,11,Total IPC,09410200,Servicios Prestados Por Escenarios Deportivos,101.11,0.08,1.11,2.99,0.0,0.0,nd,,,,,,,,,,,,
2019,11,Total IPC,09420100,Cines Y Teatros,107.95,1.23,7.95,9.51,0.0,0.02,nd,,,,,,,,,,,,
2019,11,Total IPC,09420600,Suscripción y servicio de televisión por redes y cable ,104.1,0.56,4.1,4.1,0.0,0.04,nd,,,,,,,,,,,,
2019,11,Total IPC,09510100,Libros Y Lista De Útiles Escolares Completa,101.62,0.1,1.62,nd,0.0,0.0,nd,,,,,,,,,,,,
2019,11,Total IPC,09510200,"Libros de texto: textos guías para clase (incluye libros de literatura, poesía, etc., requeridos en clase)",104.64,0.0,4.64,4.64,0.0,0.01,nd,,,,,,,,,,,,
2019,11,Total IPC,09520400,Compra de periódicos,100.8,0.0,0.8,0.8,0.0,0.0,nd,,,,,,,,,,,,
2019,11,Total IPC,09530100,Material Impreso Diverso,100.18,0.0,0.18,nd,0.0,0.0,nd,,,,,,,,,,,,
2019,11,Total IPC,09540100,"Artículos De Papelería: Cuadernos, Agendas, Papel Suelto Y En Resmas",101.03,0.11,1.03,1.15,0.0,0.0,nd,,,,,,,,,,,,
2019,11,Total IPC,09540200,Artículos Para Escribir,101.83,0.3,1.83,1.96,0.0,0.0,nd,,,,,,,,,,,,
2019,11,Total IPC,09540300,Artículos Para Pintura Y Dibujo,101.02,0.27,1.02,1.14,0.0,0.0,nd,,,,,,,,,,,,
2019,11,Total IPC,09610300,"Paquetes turísticos completos, incluye paquetes de viajes de excursión realizados durante un día (sin pernoctar)",100.91,1.4,0.91,4.91,0.01,0.01,nd,,,,,,,,,,,,
2019,11,Total IPC,10110400,Educación preescolar y básica primaria,106.16,0.0,6.16,nd,0.0,0.09,nd,,,,,,,,,,,,
2019,11,Total IPC,10210100,Educación Secundaria,106.73,0.0,6.73,nd,0.0,0.06,nd,,,,,,,,,,,,
2019,11,Total IPC,10410100,"Inscripciones y matrículas en carreras técnicas, tecnológicas y universitarias",105.72,0.0,5.72,nd,0.0,0.08,nd,,,,,,,,,,,,
2019,11,Total IPC,10410200,"Inscripciones y matrículas en postgrados (especialización, maestría, doctorado)",104.55,0.0,4.55,nd,0.0,0.01,nd,,,,,,,,,,,,
2019,11,Total IPC,10419900,Otros gastos en educación superior,103.58,0.0,3.58,nd,0.0,0.0,nd,,,,,,,,,,,,
2019,11,Total IPC,10510100,Cursos de educación no formal,103.73,0.0,3.73,nd,0.0,0.01,nd,,,,,,,,,,,,
2019,11,Total IPC,10510400,"Diplomados, educación continuada, preicfes, preuniversitarios",97.91,0.0,-2.09,nd,0.0,0.0,nd,,,,,,,,,,,,
2019,11,Total IPC,10510800,Pagos por asesorías de tareas y clases dictadas por particulares,100.53,0.0,0.53,nd,0.0,0.0,nd,,,,,,,,,,,,
2019,11,Total IPC,11110100,"Comidas en establecimientos de servicio a la mesa y autoservicio,  medios de transporte, máquinas expendedoras, puestos móviles, y lugares de esparcimiento; se incluyen también las  contratadas por encargo, para llevar y por servicio a domicilio",103.67,0.33,3.67,4.16,0.02,0.23,nd,,,,,,,,,,,,
2019,11,Total IPC,11110200,"Bebidas calientes : tinto, café con leche, chocolate, té, bebida achocolatada caliente, leche, agua de panela, agua aromática, avena caliente y similares  para consumo inmediato, en establecimientos de servicio a la mesa y autoservicio.",102.03,0.08,2.03,2.61,0.0,0.0,nd,,,,,,,,,,,,
2019,11,Total IPC,11110300,"Gaseosa Y Otros Refrescos  En Establecimientos De Servicio A La Mesa Y Autoservicio,  Medios De Transporte, Maquinas Expendedoras, Puestos Moviles, Y Lugares De Esparcimiento; Se Incluyen Tambien Las Adquiriudas Para Llevar Y Servicio A Domicilio",105.97,0.02,5.97,nd,0.0,0.02,nd,,,,,,,,,,,,
2019,11,Total IPC,11110400,"Comidas preparadas fuera del hogar para consumo inmediato, en establecimientos de servicio a la mesa y autoservicio,  puestos móviles, lugares de esparcimiento, para llevar y por servicio a domicilio",103.37,0.36,3.37,3.94,0.01,0.06,nd,,,,,,,,,,,,
2019,11,Total IPC,11110700,"Gastos en discotecas, bares, griles, tabernas, fondas y tiendas dentro y  al aire libre (comida, bebidas, cover)",105.05,0.17,5.05,nd,0.0,0.02,nd,,,,,,,,,,,,
2019,11,Total IPC,11120100,Pago Por Alimentación En Comedores,106.65,0.0,6.65,nd,0.0,0.01,nd,,,,,,,,,,,,
2019,11,Total IPC,11210100,"Servicios de alojamiento en hoteles, pensiones, posadas, hostales y moteles; alojamiento en centros de vacaciones y por motivo de enseñanza: internados",102.48,0.69,2.48,nd,0.0,0.01,nd,,,,,,,,,,,,
2019,11,Total IPC,12110100,Servicios Prestados En Salones De Peluquería Y Establecimientos De Cuidado Personal,103.45,0.09,3.45,3.71,0.0,0.03,nd,,,,,,,,,,,,
2019,11,Total IPC,12120100,Aparatos Eléctricos Para El Cuidado Personal Y Su Reparación,99.43,-0.53,-0.57,nd,0.0,0.0,nd,,,,,,,,,,,,
2019,11,Total IPC,12130100,Artículos Para El Cuidado Y La Atención Personal,104.04,-0.13,4.04,4.01,0.0,0.0,nd,,,,,,,,,,,,
2019,11,Total IPC,12130200,Artículos Para Higiene Corporal,103.44,-0.12,3.44,3.65,0.0,0.05,nd,,,,,,,,,,,,
2019,11,Total IPC,12130300,Artículos Para La Higiene Oral,100.84,-0.27,0.84,0.71,0.0,0.0,nd,,,,,,,,,,,,
2019,11,Total IPC,12130400,Productos De Belleza,100.98,0.04,0.98,1.19,0.0,0.0,nd,,,,,,,,,,,,
2019,11,Total IPC,12139900,Otros Productos Para El Aseo Personal,101.73,0.3,1.73,nd,0.0,0.02,nd,,,,,,,,,,,,
2019,11,Total IPC,12310100,"Artículos En Oro,  Plata Y Piedras Preciosas Y Su Reparación",111.31,3.01,11.31,11.38,0.0,0.01,nd,,,,,,,,,,,,
2019,11,Total IPC,12310200,"Relojes, Cronómetros, Termómetros, Barómetros Y Su Reparación",102.32,1.3,2.32,2.34,0.0,0.0,nd,,,,,,,,,,,,
2019,11,Total IPC,12310300,Artículos De Fantasía Y Su Reparación,100.74,-0.35,0.74,nd,0.0,0.0,nd,,,,,,,,,,,,
2019,11,Total IPC,12320100,Artículos De Viaje Y Otros Artículos Para El Transporte De Efectos Personales,99.64,-0.02,-0.36,-0.36,0.0,0.0,nd,,,,,,,,,,,,
2019,11,Total IPC,12320200,Artículos Para Bebés Y Su Reparación,102.33,0.2,2.33,nd,0.0,0.0,nd,,,,,,,,,,,,
2019,11,Total IPC,12320400,"Artículos personales varios como: gafas de sol, lentes de contacto cosméticos, bastones, paraguas y sombrillas, abanicos, llaveros, etc.",100.58,0.05,0.58,nd,0.0,0.0,nd,,,,,,,,,,,,
2019,11,Total IPC,12410100,Servicios de protección social dentro y fuera del hogar,103.1,0.0,3.1,nd,0.0,0.0,nd,,,,,,,,,,,,
2019,11,Total IPC,12410200,"Guarderías, salacunas, cuidado de niños fuera del hogar y servicios de adopción",106.02,0.01,6.02,nd,0.0,0.02,nd,,,,,,,,,,,,
2019,11,Total IPC,12410300,Cuotas moderadoras a EPS,106.17,0.0,6.17,6.17,0.0,0.0,nd,,,,,,,,,,,,
2019,11,Total IPC,12530100,"Seguros médicos, de accidentes y medicina prepagada",106.65,0.0,6.65,6.65,0.0,0.01,nd,,,,,,,,,,,,
2019,11,Total IPC,12540100,Seguros De Vehículos Y Otros Relacionados Con El Transporte,95.36,-0.1,-4.64,-4.73,0.0,-0.01,nd,,,,,,,,,,,,
2019,11,Total IPC,12620400,Servicios auxiliares y  financieros prestados a cambio de una comisión explicita,103.85,0.07,3.85,nd,0.0,0.01,nd,,,,,,,,,,,,
2019,11,Total IPC,12710500,"Certificados, documentos administrativos y pago de honorarios",101.69,0.0,1.69,nd,0.0,0.0,nd,,,,,,,,,,,,
2019,11,Total IPC,12719900,Otros pagos por servicios,103.09,0.27,3.09,nd,0.0,0.0,nd,,,,,,,,,,,,
2019,10,Total IPC,01110100,Arroz,109.14,0.25,9.14,8.88,0.0,0.09,nd,,,,,,,,,,,,
2019,10,Total IPC,01110200,Pastas Alimenticias,102.42,1.11,2.42,2.57,0.0,0.0,nd,,,,,,,,,,,,
2019,10,Total IPC,01110300,Avena Y Sus Derivados,95.6,-0.45,-4.4,-4.69,0.0,0.0,nd,,,,,,,,,,,,
2019,10,Total IPC,01110500,Trigo Y Sus Derivados,102.28,-0.05,2.28,2.1,0.0,0.0,nd,,,,,,,,,,,,
2019,10,Total IPC,01110600,Maíz Y Sus Derivados,107.16,1.26,7.16,6.97,0.0,0.01,nd,,,,,,,,,,,,
2019,10,Total IPC,01110800,Pan,103.25,-0.08,3.25,3.95,0.0,0.02,nd,,,,,,,,,,,,
2019,10,Total IPC,01119800,"Otras Harinas, Cereales Y Almidones",101.85,-0.16,1.85,2.09,0.0,0.01,nd,,,,,,,,,,,,
2019,10,Total IPC,01119900,Otros Productos De Panadería,100.65,0.16,0.65,1.49,0.0,0.0,nd,,,,,,,,,,,,
2019,10,Total IPC,01120100,Carne De Res Y Derivados,103.64,-0.36,3.64,3.85,-0.01,0.07,nd,,,,,,,,,,,,
2019,10,Total IPC,01120200,Carne De Cerdo Y Derivados,101.04,0.22,1.04,2.69,0.0,0.0,nd,,,,,,,,,,,,
2019,10,Total IPC,01120300,Carne De Aves,103.0,0.47,3.0,4.62,0.01,0.04,nd,,,,,,,,,,,,
2019,10,Total IPC,01120500,"Carnes Preparadas, Charcutería Y Otros Productos Conteniendo Carne",103.23,0.93,3.23,3.04,0.0,0.01,nd,,,,,,,,,,,,
2019,10,Total IPC,01130300,Productos de rio y mar (incluye pescados y camarones frescos o congelados y pescado enlatado como sardinas y atún),104.03,0.02,4.03,5.21,0.0,0.02,nd,,,,,,,,,,,,
2019,10,Total IPC,01140100,Leche,104.49,0.7,4.49,4.5,0.01,0.05,nd,,,,,,,,,,,,
2019,10,Total IPC,01140200,Quesos Y Productos Afines,102.54,0.11,2.54,4.04,0.0,0.01,nd,,,,,,,,,,,,
2019,10,Total IPC,01140500,Huevos,104.63,-0.46,4.63,7.82,0.0,0.03,nd,,,,,,,,,,,,
2019,10,Total IPC,01149900,Otros Derivados De La Leche,103.13,0.29,3.13,4,0.0,0.01,nd,,,,,,,,,,,,
2019,10,Total IPC,01150100,Aceites Comestibles,102.47,0.46,2.47,2.65,0.0,0.01,nd,,,,,,,,,,,,
2019,10,Total IPC,01150200,Mantequilla De Vaca,111.71,1.9,11.71,12.65,0.0,0.01,nd,,,,,,,,,,,,
2019,10,Total IPC,01150500,Margarinas y grasas animales y vegetales,101.55,0.15,1.55,1.7,0.0,0.0,nd,,,,,,,,,,,,
2019,10,Total IPC,01160200,Frutas Congeladas O En Pulpa,100.85,-0.17,0.85,nd,0.0,0.0,nd,,,,,,,,,,,,
2019,10,Total IPC,01160300,"Frutos Secos Y Nueces, Cáscaras De Frutas Y Semillas Comestibles",102.81,-0.24,2.81,nd,0.0,0.0,nd,,,,,,,,,,,,
2019,10,Total IPC,01160500,Naranjas,113.14,-3.62,13.14,3.72,0.0,0.01,nd,,,,,,,,,,,,
2019,10,Total IPC,01160600,Bananos,111.82,2.4,11.82,13.03,0.0,0.01,nd,,,,,,,,,,,,
2019,10,Total IPC,01160700,Tomate de árbol,100.61,-0.75,0.61,-9.35,0.0,0.0,nd,,,,,,,,,,,,
2019,10,Total IPC,01160800,Moras,103.54,0.03,3.54,7.6,0.0,0.0,nd,,,,,,,,,,,,
2019,10,Total IPC,01160900,Frutas frescas,132.23,-0.05,32.23,17.44,0.0,0.23,nd,,,,,,,,,,,,
2019,10,Total IPC,01170200,Legumbres Secas,94.45,-1.05,-5.55,-4.61,0.0,-0.01,nd,,,,,,,,,,,,
2019,10,Total IPC,01170300,Legumbres Y Hortalizas En Conserva Y Deshidratadas,102.52,0.1,2.52,1.95,0.0,0.0,nd,,,,,,,,,,,,
2019,10,Total IPC,01170400,Plátanos,127.77,1.94,27.77,28.57,0.01,0.09,nd,,,,,,,,,,,,
2019,10,Total IPC,01170500,Papas,119.41,0.99,19.41,32.47,0.0,0.06,nd,,,,,,,,,,,,
2019,10,Total IPC,01170600,Yuca Para Consumo En El Hogar,106.31,-1.0,6.31,1.07,0.0,0.01,nd,,,,,,,,,,,,
2019,10,Total IPC,01171100,"Productos Derivados De Los Tubérculos, Raíces Y Plátanos",102.52,0.22,2.52,nd,0.0,0.0,nd,,,,,,,,,,,,
2019,10,Total IPC,01171200,"Arracacha, ñame y otros tubérculos",126.25,-9.73,26.25,9.85,0.0,0.01,nd,,,,,,,,,,,,
2019,10,Total IPC,01171300,Tomate,118.34,6.27,18.34,28.68,0.01,0.03,nd,,,,,,,,,,,,
2019,10,Total IPC,01171400,Cebolla,99.54,-3.36,-0.46,13.02,-0.01,0.0,nd,,,,,,,,,,,,
2019,10,Total IPC,01171500,Zanahoria,120.91,-2.55,20.91,26.52,0.0,0.01,nd,,,,,,,,,,,,
2019,10,Total IPC,01171600,Hortalizas y legumbres frescas ,124.07,3.86,24.07,27.34,0.02,0.08,nd,,,,,,,,,,,,
2019,10,Total IPC,01180100,Azúcar Y Otros Endulzantes,109.57,-1.46,9.57,12.1,0.0,0.02,nd,,,,,,,,,,,,
2019,10,Total IPC,01180200,Panela Cruda Para Consumo En El Hogar,96.32,-0.44,-3.68,-3.74,0.0,-0.01,nd,,,,,,,,,,,,
2019,10,Total IPC,01180300,"Jaleas, Mermeladas, Miel Y Similares",103.88,0.53,3.88,3.97,0.0,0.0,nd,,,,,,,,,,,,
2019,10,Total IPC,01180500,"Dulces, Confites, Caramelos, Bombones, Chocolatinas, Chicles, Masmelos, Cocadas Para Consumo En El Hogar",103.21,0.04,3.21,3.35,0.0,0.0,nd,,,,,,,,,,,,
2019,10,Total IPC,01180600,"Helados, Conos, Paletas, Vasitos, Refrescos Congelados Y Tortas Heladas Para Consumo En El Hogar",102.33,0.43,2.33,nd,0.0,0.0,nd,,,,,,,,,,,,
2019,10,Total IPC,01180700,"Gelatinas, Flanes Y Pudines En Polvo Para Preparar",99.33,-0.47,-0.67,-0.54,0.0,0.0,nd,,,,,,,,,,,,
2019,10,Total IPC,01190100,"Salsas, Pastas Y Aderezos",100.16,-0.12,0.16,0.47,0.0,0.0,nd,,,,,,,,,,,,
2019,10,Total IPC,01190200,Sal,107.86,0.59,7.86,10.1,0.0,0.0,nd,,,,,,,,,,,,
2019,10,Total IPC,01190500,"Sopas, Cremas, Caldos Y Consomés",103.16,0.17,3.16,3.98,0.0,0.0,nd,,,,,,,,,,,,
2019,10,Total IPC,01190600,"Frituras: papas fritas, chitos, maizitos, patacones, besitos, etc., para consumo en el hogar",105.5,0.37,5.5,5,0.0,0.01,nd,,,,,,,,,,,,
2019,10,Total IPC,01190800,Condimentos y hierbas culinarias,112.8,7.54,12.8,nd,0.0,0.01,nd,,,,,,,,,,,,
2019,10,Total IPC,01191100,Leche En Polvo Para Lactantes,101.05,0.35,1.05,1.07,0.0,0.0,nd,,,,,,,,,,,,
2019,10,Total IPC,01199900,"Otros Alimentos Precocidos Y Preparados: Ajiaco, Lenteja, Frijol, Lechona Enlatada Y Similares",101.05,-0.5,1.05,nd,0.0,0.0,nd,,,,,,,,,,,,
2019,10,Total IPC,01210100,Café Y Productos A Base De Café,100.89,0.5,0.89,1.02,0.0,0.0,nd,,,,,,,,,,,,
2019,10,Total IPC,01210200,Chocolate Y Productos A Base De Chocolate,100.24,-0.65,0.24,0.96,0.0,0.0,nd,,,,,,,,,,,,
2019,10,Total IPC,01210300,Té E Infusiones (Para Bebidas Calientes),100.23,-0.98,0.23,nd,0.0,0.0,nd,,,,,,,,,,,,
2019,10,Total IPC,01220100,Agua Mineral (Con Y Sin Gas) Para Consumo En El Hogar,107.19,0.32,7.19,7.95,0.0,0.01,nd,,,,,,,,,,,,
2019,10,Total IPC,01220600,"Refrescos Líquidos Empacados (Jugos, Té Fríos Y Bebidas Hidratantes)",102.72,-0.13,2.72,2.38,0.0,0.0,nd,,,,,,,,,,,,
2019,10,Total IPC,01220700,Concentrados Para Preparar Refrescos,86.81,-0.69,-13.19,-13.48,0.0,0.0,nd,,,,,,,,,,,,
2019,10,Total IPC,01221100,Gaseosas y maltas para consumo en el hogar,107.9,0.16,7.9,8.64,0.0,0.03,nd,,,,,,,,,,,,
2019,10,Total IPC,01221200,"Bebidas energizantes y a base de arroz, soya, coco y similares",101.52,-0.23,1.52,nd,0.0,0.0,nd,,,,,,,,,,,,
2019,10,Total IPC,02110100,Aguardiente,110.63,0.15,10.63,11.35,0.0,0.01,nd,,,,,,,,,,,,
2019,10,Total IPC,02110500,"Whisky, ron, brandy, vodka, ginebra, coñac, tequila, cremas de licor y aperitivos",107.52,0.0,7.52,7.28,0.0,0.03,nd,,,,,,,,,,,,
2019,10,Total IPC,02120100,"Vino, Champaña, Jerez Y Aperitivos A Base De Vino Para Consumo En El Hogar",110.04,1.29,10.04,9.79,0.0,0.01,nd,,,,,,,,,,,,
2019,10,Total IPC,02130100,Cerveza Y Refajo,100.96,0.34,0.96,1.38,0.0,0.01,nd,,,,,,,,,,,,
2019,10,Total IPC,02210100,"Cigarrillos, tabaco y derivados",112.97,0.21,12.97,14.33,0.0,0.02,nd,,,,,,,,,,,,
2019,10,Total IPC,03120100,Prendas De Vestir Para Hombre,101.01,0.02,1.01,1.37,0.0,0.01,nd,,,,,,,,,,,,
2019,10,Total IPC,03120200,Prendas De Vestir Para Mujer,99.07,-0.02,-0.93,-0.9,0.0,-0.01,nd,,,,,,,,,,,,
2019,10,Total IPC,03120500,Prendas De Vestir Para Bebés,101.72,0.31,1.72,1.87,0.0,0.0,nd,,,,,,,,,,,,
2019,10,Total IPC,03120600,Uniformes,103.78,0.0,3.78,3.78,0.0,0.01,nd,,,,,,,,,,,,
2019,10,Total IPC,03120700,Prendas de vestir para niña y niño,100.6,0.27,0.6,1,0.0,0.0,nd,,,,,,,,,,,,
2019,10,Total IPC,03131000,"Otros artículos y accesorios de vestir para hombre y mujer, incluyendo artículos de vestir para adulto y bebé y materiales",101.4,0.29,1.4,1.38,0.0,0.0,nd,,,,,,,,,,,,
2019,10,Total IPC,03140200,Lavado Y Planchado De Ropa,103.46,-0.01,3.46,4.17,0.0,0.0,nd,,,,,,,,,,,,
2019,10,Total IPC,03210100,Calzado Para Hombre,99.95,-0.19,-0.05,0.01,0.0,0.0,nd,,,,,,,,,,,,
2019,10,Total IPC,03210200,Calzado Para Mujer,100.63,0.21,0.63,0.69,0.0,0.0,nd,,,,,,,,,,,,
2019,10,Total IPC,03210700,Calzado para niño y niña,100.3,0.14,0.3,0.63,0.0,0.0,nd,,,,,,,,,,,,
2019,10,Total IPC,04130100,Arriendo efectivo ,102.38,0.07,2.38,2.78,0.01,0.25,nd,,,,,,,,,,,,
2019,10,Total IPC,04230100,Arriendo imputado,102.39,0.07,2.39,2.81,0.01,0.35,nd,,,,,,,,,,,,
2019,10,Total IPC,04310100,Materiales Para La Conservación Y La Reparación De La Vivienda,101.43,0.15,1.43,nd,0.0,0.0,nd,,,,,,,,,,,,
2019,10,Total IPC,04410100,Suministro De Agua,104.34,0.05,4.34,4.36,0.0,0.08,nd,,,,,,,,,,,,
2019,10,Total IPC,04420100,Recogida De Basuras,109.2,0.94,9.2,9.23,0.0,0.04,nd,,,,,,,,,,,,
2019,10,Total IPC,04430100,Alcantarillado,110.11,0.03,10.11,10.14,0.0,0.05,nd,,,,,,,,,,,,
2019,10,Total IPC,04440100,Servicios Relacionados Con La Copropiedad,105.72,0.02,5.72,5.82,0.0,0.07,nd,,,,,,,,,,,,
2019,10,Total IPC,04510100,Electricidad,103.32,0.83,3.32,4.77,0.02,0.1,nd,,,,,,,,,,,,
2019,10,Total IPC,04520300,Gas,103.97,1.48,3.97,5.5,0.01,0.04,nd,,,,,,,,,,,,
2019,10,Total IPC,05110100,Muebles,101.32,0.1,1.32,nd,0.0,0.01,nd,,,,,,,,,,,,
2019,10,Total IPC,05110200,Equipo De Iluminación,101.5,0.34,1.5,nd,0.0,0.0,nd,,,,,,,,,,,,
