2019,6,Total Nacional,01160500,Naranjas,110.51,0.44,10.51,9.3,0.0,0.01,nd,,,,,,,,,,,,
2019,6,Total Nacional,01160600,Bananos,104.43,0.1,4.43,2.7,0.0,0.0,nd,,,,,,,,,,,,
2019,6,Total Nacional,01160700,Tomate de árbol,116.49,10.2,16.49,3.83,0.01,0.01,nd,,,,,,,,,,,,
2019,6,Total Nacional,01160800,Moras,113.51,-2.18,13.51,5.24,0.0,0.01,nd,,,,,,,,,,,,
2019,6,Total Nacional,01160900,Frutas frescas,112.8,-0.87,12.8,13.89,-0.01,0.09,nd,,,,,,,,,,,,
2019,6,Total Nacional,01170200,Legumbres Secas,96.28,-0.35,-3.72,-7.77,0.0,-0.01,nd,,,,,,,,,,,,
2019,6,Total Nacional,01170300,Legumbres Y Hortalizas En Conserva Y Deshidratadas,100.94,1.04,0.94,0.09,0.0,0.0,nd,,,,,,,,,,,,
2019,6,Total Nacional,01170400,Plátanos,125.23,5.89,25.23,29.34,0.02,0.08,nd,,,,,,,,,,,,
2019,6,Total Nacional,01170500,Papas,127.52,1.9,27.52,38.71,0.01,0.08,nd,,,,,,,,,,,,
2019,6,Total Nacional,01170600,Yuca Para Consumo En El Hogar,112.66,-0.56,12.66,44.35,0.0,0.01,nd,,,,,,,,,,,,
2019,6,Total Nacional,01171100,"Productos Derivados De Los Tubérculos, Raíces Y Plátanos",101.59,-0.17,1.59,nd,0.0,0.0,nd,,,,,,,,,,,,
2019,6,Total Nacional,01171200,"Arracacha, ñame y otros tubérculos",123.65,0.83,23.65,36.38,0.0,0.01,nd,,,,,,,,,,,,
2019,6,Total Nacional,01171300,Tomate,152.39,7.84,52.39,0.05,0.02,0.09,nd,,,,,,,,,,,,
2019,6,Total Nacional,01171400,Cebolla,102.49,1.26,2.49,37.86,0.0,0.01,nd,,,,,,,,,,,,
2019,6,Total Nacional,01171500,Zanahoria,122.74,8.28,22.74,-4.96,0.0,0.01,nd,,,,,,,,,,,,
2019,6,Total Nacional,01171600,Hortalizas y legumbres frescas ,112.33,2.36,12.33,5.13,0.01,0.04,nd,,,,,,,,,,,,
2019,6,Total Nacional,01180100,Azúcar Y Otros Endulzantes,109.71,2.67,9.71,6.48,0.01,0.02,nd,,,,,,,,,,,,
2019,6,Total Nacional,01180200,Panela Cruda Para Consumo En El Hogar,97.76,-0.49,-2.24,-8.97,0.0,0.0,nd,,,,,,,,,,,,
2019,6,Total Nacional,01180300,"Jaleas, Mermeladas, Miel Y Similares",101.38,0.23,1.38,1.33,0.0,0.0,nd,,,,,,,,,,,,
2019,6,Total Nacional,01180500,"Dulces, Confites, Caramelos, Bombones, Chocolatinas, Chicles, Masmelos, Cocadas Para Consumo En El Hogar",103.64,0.07,3.64,3.31,0.0,0.0,nd,,,,,,,,,,,,
2019,6,Total Nacional,01180600,"Helados, Conos, Paletas, Vasitos, Refrescos Congelados Y Tortas Heladas Para Consumo En El Hogar",101.41,0.15,1.41,nd,0.0,0.0,nd,,,,,,,,,,,,
2019,6,Total Nacional,01180700,"Gelatinas, Flanes Y Pudines En Polvo Para Preparar",100.59,0.39,0.59,0.27,0.0,0.0,nd,,,,,,,,,,,,
2019,6,Total Nacional,01190100,"Salsas, Pastas Y Aderezos",101.16,0.4,1.16,1.97,0.0,0.0,nd,,,,,,,,,,,,
2019,6,Total Nacional,01190200,Sal,105.62,1.52,5.62,11,0.0,0.0,nd,,,,,,,,,,,,
2019,6,Total Nacional,01190500,"Sopas, Cremas, Caldos Y Consomés",102.58,1.13,2.58,0.89,0.0,0.0,nd,,,,,,,,,,,,
2019,6,Total Nacional,01190600,"Frituras: papas fritas, chitos, maizitos, patacones, besitos, etc., para consumo en el hogar",103.88,0.82,3.88,3.78,0.0,0.0,nd,,,,,,,,,,,,
2019,6,Total Nacional,01190800,Condimentos y hierbas culinarias,104.77,3.73,4.77,nd,0.0,0.0,nd,,,,,,,,,,,,
2019,6,Total Nacional,01191100,Leche En Polvo Para Lactantes,100.91,0.02,0.91,0.59,0.0,0.0,nd,,,,,,,,,,,,
2019,6,Total Nacional,01199900,"Otros Alimentos Precocidos Y Preparados: Ajiaco, Lenteja, Frijol, Lechona Enlatada Y Similares",100.86,0.05,0.86,nd,0.0,0.0,nd,,,,,,,,,,,,
2019,6,Total Nacional,01210100,Café Y Productos A Base De Café,101.1,-0.12,1.1,0.84,0.0,0.0,nd,,,,,,,,,,,,
2019,6,Total Nacional,01210200,Chocolate Y Productos A Base De Chocolate,100.5,0.42,0.5,0.55,0.0,0.0,nd,,,,,,,,,,,,
2019,6,Total Nacional,01210300,Té E Infusiones (Para Bebidas Calientes),100.32,-0.47,0.32,nd,0.0,0.0,nd,,,,,,,,,,,,
2019,6,Total Nacional,01220100,Agua Mineral (Con Y Sin Gas) Para Consumo En El Hogar,106.42,1.28,6.42,5.93,0.0,0.01,nd,,,,,,,,,,,,
2019,6,Total Nacional,01220600,"Refrescos Líquidos Empacados (Jugos, Té Fríos Y Bebidas Hidratantes)",102.28,0.63,2.28,2.16,0.0,0.0,nd,,,,,,,,,,,,
2019,6,Total Nacional,01220700,Concentrados Para Preparar Refrescos,97.89,-2.84,-2.11,-2.23,0.0,0.0,nd,,,,,,,,,,,,
2019,6,Total Nacional,01221100,Gaseosas y maltas para consumo en el hogar,106.95,-0.03,6.95,7.76,0.0,0.03,nd,,,,,,,,,,,,
2019,6,Total Nacional,01221200,"Bebidas energizantes y a base de arroz, soya, coco y similares",102.03,-0.24,2.03,nd,0.0,0.0,nd,,,,,,,,,,,,
2019,6,Total Nacional,02110100,Aguardiente,111.45,0.68,11.45,11.83,0.0,0.02,nd,,,,,,,,,,,,
2019,6,Total Nacional,02110500,"Whisky, ron, brandy, vodka, ginebra, coñac, tequila, cremas de licor y aperitivos",106.91,0.56,6.91,6.34,0.0,0.02,nd,,,,,,,,,,,,
2019,6,Total Nacional,02120100,"Vino, Champaña, Jerez Y Aperitivos A Base De Vino Para Consumo En El Hogar",106.55,0.42,6.55,5.98,0.0,0.01,nd,,,,,,,,,,,,
2019,6,Total Nacional,02130100,Cerveza Y Refajo,101.38,0.04,1.38,3.35,0.0,0.01,nd,,,,,,,,,,,,
2019,6,Total Nacional,02210100,"Cigarrillos, tabaco y derivados",112.17,0.4,12.17,15.13,0.0,0.02,nd,,,,,,,,,,,,
2019,6,Total Nacional,03120100,Prendas De Vestir Para Hombre,100.81,0.31,0.81,1.2,0.0,0.01,nd,,,,,,,,,,,,
2019,6,Total Nacional,03120200,Prendas De Vestir Para Mujer,99.21,-0.23,-0.79,-0.83,0.0,-0.01,nd,,,,,,,,,,,,
2019,6,Total Nacional,03120500,Prendas De Vestir Para Bebés,100.76,0.22,0.76,0.99,0.0,0.0,nd,,,,,,,,,,,,
2019,6,Total Nacional,03120600,Uniformes,103.41,0.0,3.41,3.99,0.0,0.01,nd,,,,,,,,,,,,
2019,6,Total Nacional,03120700,Prendas de vestir para niña y niño,100.31,0.26,0.31,0.97,0.0,0.0,nd,,,,,,,,,,,,
2019,6,Total Nacional,03131000,"Otros artículos y accesorios de vestir para hombre y mujer, incluyendo artículos de vestir para adulto y bebé y materiales",100.98,0.05,0.98,0.58,0.0,0.0,nd,,,,,,,,,,,,
2019,6,Total Nacional,03140200,Lavado Y Planchado De Ropa,102.56,0.49,2.56,3.96,0.0,0.0,nd,,,,,,,,,,,,
2019,6,Total Nacional,03210100,Calzado Para Hombre,99.9,0.09,-0.1,-0.23,0.0,0.0,nd,,,,,,,,,,,,
2019,6,Total Nacional,03210200,Calzado Para Mujer,100.3,0.11,0.3,0.16,0.0,0.0,nd,,,,,,,,,,,,
2019,6,Total Nacional,03210700,Calzado para niño y niña,100.12,0.06,0.12,-0.04,0.0,0.0,nd,,,,,,,,,,,,
2019,6,Total Nacional,04130100,Arriendo efectivo ,101.76,0.25,1.76,3.02,0.03,0.19,nd,,,,,,,,,,,,
2019,6,Total Nacional,04230100,Arriendo imputado,101.76,0.27,1.76,3.09,0.04,0.26,nd,,,,,,,,,,,,
2019,6,Total Nacional,04310100,Materiales Para La Conservación Y La Reparación De La Vivienda,100.68,-0.08,0.68,nd,0.0,0.0,nd,,,,,,,,,,,,
2019,6,Total Nacional,04410100,Suministro De Agua,104.27,0.63,4.27,5.17,0.01,0.08,nd,,,,,,,,,,,,
2019,6,Total Nacional,04420100,Recogida De Basuras,106.82,0.58,6.82,7.75,0.0,0.03,nd,,,,,,,,,,,,
2019,6,Total Nacional,04430100,Alcantarillado,108.82,0.15,8.82,9.77,0.0,0.04,nd,,,,,,,,,,,,
2019,6,Total Nacional,04440100,Servicios Relacionados Con La Copropiedad,104.45,0.66,4.45,5,0.01,0.05,nd,,,,,,,,,,,,
2019,6,Total Nacional,04510100,Electricidad,101.82,-2.22,1.82,6.49,-0.07,0.05,nd,,,,,,,,,,,,
2019,6,Total Nacional,04520300,Gas,102.57,0.43,2.57,8.68,0.0,0.03,nd,,,,,,,,,,,,
2019,6,Total Nacional,05110100,Muebles,101.23,0.28,1.23,nd,0.0,0.01,nd,,,,,,,,,,,,
2019,6,Total Nacional,05110200,Equipo De Iluminación,100.34,0.14,0.34,nd,0.0,0.0,nd,,,,,,,,,,,,
2019,6,Total Nacional,05119900,Otros Artículos De Decoración,98.92,-0.01,-1.08,nd,0.0,0.0,nd,,,,,,,,,,,,
2019,6,Total Nacional,05210200,Ropa confeccionada para cama,101.27,0.19,1.27,0.86,0.0,0.0,nd,,,,,,,,,,,,
2019,6,Total Nacional,05210700,Ropa de tocador y productos textiles del hogar,101.71,0.42,1.71,2.47,0.0,0.0,nd,,,,,,,,,,,,
2019,6,Total Nacional,05310100,"Neveras, Refrigeradores Y Congeladores",102.71,0.14,2.71,3.28,0.0,0.0,nd,,,,,,,,,,,,
2019,6,Total Nacional,05310200,"Lavadoras, Secadoras Y Lava-Vajillas",102.57,0.42,2.57,1.21,0.0,0.0,nd,,,,,,,,,,,,
2019,6,Total Nacional,05310300,"Estufas, Hornos Y Pipetas De Gas",102.83,0.65,2.83,2.72,0.0,0.0,nd,,,,,,,,,,,,
2019,6,Total Nacional,05320100,Aparatos Eléctricos  Pequeños Para El Hogar,100.86,-0.44,0.86,nd,0.0,0.0,nd,,,,,,,,,,,,
2019,6,Total Nacional,05410100,"Cristalería y vajilla Artículos, vajillas y utensilios de vidrio, cristal, porcelana y cerámica para el hogar",102.53,0.42,2.53,3.55,0.0,0.0,nd,,,,,,,,,,,,
2019,6,Total Nacional,05410300,Utensilios de cocina y menaje no eléctricos,100.66,0.32,0.66,1.13,0.0,0.0,nd,,,,,,,,,,,,
2019,6,Total Nacional,05520300,Accesorios Eléctricos Pequeños,98.45,-0.34,-1.55,-1.73,0.0,0.0,nd,,,,,,,,,,,,
2019,6,Total Nacional,05610100,Productos De Limpieza Y Mantenimiento,102.19,0.25,2.19,2.32,0.0,0.03,nd,,,,,,,,,,,,
2019,6,Total Nacional,05610200,Elementos De Aseo,103.47,0.16,3.47,3.5,0.0,0.01,nd,,,,,,,,,,,,
2019,6,Total Nacional,05610400,"Artículos De Ferretería: Puntillas, Clavos, Tornillos, Tuercas, Brocas, Brochas, Pinceles, Lijas Y Otros.",100.63,0.09,0.63,nd,0.0,0.0,nd,,,,,,,,,,,,
2019,6,Total Nacional,05610600,Productos desechables y no duraderos para el hogar,101.6,0.31,1.6,nd,0.0,0.0,nd,,,,,,,,,,,,
2019,6,Total Nacional,05620100,Servicio Doméstico,103.41,0.11,3.41,3.95,0.0,0.04,nd,,,,,,,,,,,,
2019,6,Total Nacional,06110300,Productos farmacéuticos y dermatológicos,100.83,0.34,0.83,1.51,0.0,0.01,nd,,,,,,,,,,,,
2019,6,Total Nacional,06120100,Elementos Implementos Médicos,101.06,0.55,1.06,nd,0.0,0.0,nd,,,,,,,,,,,,
2019,6,Total Nacional,06130100,Artefactos Y Equipo Terapéutico Y Su Reparación,102.23,0.43,2.23,4.06,0.0,0.0,nd,,,,,,,,,,,,
2019,6,Total Nacional,06210100,Consulta Médica General Con Médico Particular,104.02,0.21,4.02,5.17,0.0,0.0,nd,,,,,,,,,,,,
2019,6,Total Nacional,06210500,"Consulta médica con médico especialista particular (incluye ortodoncia): pediatría, oftalmología, ginecología, siquiatría, traumatología, cardiología y otros especialistas",102.89,0.31,2.89,3.5,0.0,0.01,nd,,,,,,,,,,,,
2019,6,Total Nacional,06220100,"Servicios Odontológicos Con Odontólogos Particulares: Consultas, Profilaxis, Exodoncias (Extracción), Amalgamas, Sellantes, Fluorización.",101.79,0.0,1.79,2.92,0.0,0.0,nd,,,,,,,,,,,,
2019,6,Total Nacional,06230100,"Servicios Para Particulares En Centros De Rayos X: Radiografías (Incluyendo Las Dentales), Urografías, Mamografías, Electrocardiogramas Y Otras Imágenes Diagnósticas",102.57,0.24,2.57,3.18,0.0,0.0,nd,,,,,,,,,,,,
2019,6,Total Nacional,06230200,"Exámenes De Laboratorio Para Particulares: De Sangre, Bacteriológicos, Etc.",102.39,0.06,2.39,2.99,0.0,0.0,nd,,,,,,,,,,,,
2019,6,Total Nacional,06230300,Servicios Médicos Auxiliares No Hospitalarios,101.74,0.04,1.74,nd,0.0,0.0,nd,,,,,,,,,,,,
2019,6,Total Nacional,06310300,"Servicios médicos menores (pequeña cirugía, cirugía ambulatoria, urgencias, etc.)",99.68,0.05,-0.32,-0.09,0.0,0.0,nd,,,,,,,,,,,,
2019,6,Total Nacional,07110100,Vehículo Particular Nuevo O Usado,101.52,0.49,1.52,1.59,0.01,0.04,nd,,,,,,,,,,,,
2019,6,Total Nacional,07120100,Motos Y Bicicletas Con Motor Nuevas O Usadas,102.15,0.33,2.15,1.73,0.0,0.01,nd,,,,,,,,,,,,
2019,6,Total Nacional,07130100,Compra De Bicicletas Nuevas O Usadas (Excepto Para Niños),101.0,-0.33,1.0,2.02,0.0,0.0,nd,,,,,,,,,,,,
2019,6,Total Nacional,07210100,"Llantas Y Neumáticos, Rines Para Vehículo",104.3,0.49,4.3,5.15,0.0,0.0,nd,,,,,,,,,,,,
2019,6,Total Nacional,07210300,"Productos Para La Limpieza Y Conservación Del  Vehículo: Pintura, Limpiadores, Selladores, Shampoo, Ceras, Ambientadores, Eliminador De Olores, Pañitos Húmedos Para Vehículos, Etc.",102.69,1.44,2.69,nd,0.0,0.0,nd,,,,,,,,,,,,
2019,6,Total Nacional,07210600,"Piezas Para Bicicleta: Llantas, Neumáticos, Rines, Manzanas, Cadenas, Cambios, Piñones, Guallas, Sillines, Candados Y Cable Candado, Luces, Etc.",103.9,0.1,3.9,nd,0.0,0.0,nd,,,,,,,,,,,,
2019,6,Total Nacional,07219900,Otras Piezas De Repuesto Para Vehículo,103.3,0.75,3.3,4.1,0.0,0.0,nd,,,,,,,,,,,,
2019,6,Total Nacional,07220400,"Aditivos, Valvulinas, Líquido Para Frenos, Refrigerantes, Agua Para Batería, Etc.",100.52,0.52,0.52,nd,0.0,0.0,nd,,,,,,,,,,,,
2019,6,Total Nacional,07220500,Combustibles para vehículos,100.57,0.26,0.57,3.18,0.01,0.02,nd,,,,,,,,,,,,
2019,6,Total Nacional,07230100,"Mantenimiento Y Reparaciones Efectuadas En El Taller: Engrase, Sincronización, Revisiones Técnicas, Instalaciones De Partes Y Accesorios, Balanceo De Ruedas, Despinchada, Lavado Y Polichado, Servicios De Grúa, Etc.",101.77,0.18,1.77,2.77,0.0,0.01,nd,,,,,,,,,,,,
2019,6,Total Nacional,07230200,Compra Y Cambio De Aceite,102.71,0.17,2.71,3.63,0.0,0.0,nd,,,,,,,,,,,,
2019,6,Total Nacional,07230300,Servicios De Latonería Y Pintura,100.16,0.0,0.16,nd,0.0,0.0,nd,,,,,,,,,,,,
2019,6,Total Nacional,07240100,Parqueaderos,102.68,0.12,2.68,3.54,0.0,0.01,nd,,,,,,,,,,,,
2019,6,Total Nacional,07240200,Peajes,102.95,0.0,2.95,nd,0.0,0.0,nd,,,,,,,,,,,,
2019,6,Total Nacional,07240300,"Gastos Reglamentarios Relacionados Con La Propiedad, Manejo Y Alquiler De Vehículos",105.5,-0.01,5.5,nd,0.0,0.01,nd,,,,,,,,,,,,
2019,6,Total Nacional,07330100,Transporte De Pasajeros Y Equipaje En Avión (Incluye Pagos Por Exceso De Equipaje),101.44,3.71,1.44,-2.66,0.01,0.0,nd,,,,,,,,,,,,
2019,6,Total Nacional,07371000,Transporte urbano  (incluye tren y metro),103.85,0.14,3.85,4.41,0.01,0.18,nd,,,,,,,,,,,,
2019,6,Total Nacional,07372000,"Transporte intermunicipal, interveredal e internacional",97.04,6.59,-2.96,4.55,0.02,-0.01,nd,,,,,,,,,,,,
2019,6,Total Nacional,07373000,Transporte escolar,103.71,0.0,3.71,4.28,0.0,0.01,nd,,,,,,,,,,,,
2019,6,Total Nacional,08210200,"Equipos de telefonía móvil, similares y reparación",93.54,-1.49,-6.46,-15.79,-0.01,-0.02,nd,,,,,,,,,,,,
2019,6,Total Nacional,08310400,Servicios de comunicación fija y móvil y provisión a internet,102.49,0.0,2.49,0.86,0.0,0.1,nd,,,,,,,,,,,,
2019,6,Total Nacional,09110100,"Equipo Para La Recepción, Grabación Y Reproducción De Sonido Únicamente",97.91,-0.65,-2.09,-2.71,0.0,0.0,nd,,,,,,,,,,,,
2019,6,Total Nacional,09110200,"Equipo Para La Grabación, Recepción Y Reproducción  De Imagen Y Sonido",97.13,0.11,-2.87,-6.88,0.0,-0.01,nd,,,,,,,,,,,,
2019,6,Total Nacional,09130100,Aparatos De Procesamiento De Información Y Hardware,98.93,-0.5,-1.07,-5.4,0.0,0.0,nd,,,,,,,,,,,,
2019,6,Total Nacional,09310200,Juegos Y Juguetes Infantiles,100.7,0.05,0.7,nd,0.0,0.0,nd,,,,,,,,,,,,
2019,6,Total Nacional,09310300,"Artículos, Adornos Y Prendas De Vestir Para Fiestas",101.79,0.31,1.79,nd,0.0,0.0,nd,,,,,,,,,,,,
2019,6,Total Nacional,09330200,"Plantas Naturales: Ramos De Flores, Matas, Arbustos",100.85,0.76,0.85,0.23,0.0,0.0,nd,,,,,,,,,,,,
2019,6,Total Nacional,09340200,Alimentos Para Animales Domésticos Y Mascotas,103.96,-0.5,3.96,3.31,0.0,0.01,nd,,,,,,,,,,,,
2019,6,Total Nacional,09340300,"Productos  Para Animales Domésticos Y Mascotas, Productos De Veterinaria, Artículos Para El Cuidado E Higiene (Shampoo, Jabón, Desodorantes) Y Accesorios Para Mascotas (Collares, Perrera, Jaula, Acuarios Y Otros)",100.89,0.07,0.89,nd,0.0,0.0,nd,,,,,,,,,,,,
2019,6,Total Nacional,09350100,"Servicios De Veterinaria Y De Otro Tipo Para Animales Domésticos: Cuidado, Salón De Belleza, Alojamiento, Entrenamiento, Paseadores De Perros Y Colegios Para Mascotas Etc.",103.48,0.33,3.48,4.32,0.0,0.0,nd,,,,,,,,,,,,
2019,6,Total Nacional,09410100,Servicios Recreativos,101.75,0.02,1.75,2.9,0.0,0.0,nd,,,,,,,,,,,,
2019,6,Total Nacional,09410200,Servicios Prestados Por Escenarios Deportivos,101.99,-0.55,1.99,3.14,0.0,0.0,nd,,,,,,,,,,,,
2019,6,Total Nacional,09420100,Cines Y Teatros,107.57,1.28,7.57,10.02,0.0,0.02,nd,,,,,,,,,,,,
2019,6,Total Nacional,09420600,Suscripción y servicio de televisión por redes y cable ,102.74,0.0,2.74,3.42,0.0,0.02,nd,,,,,,,,,,,,
2019,6,Total Nacional,09510100,Libros Y Lista De Útiles Escolares Completa,100.25,0.04,0.25,nd,0.0,0.0,nd,,,,,,,,,,,,
2019,6,Total Nacional,09510200,"Libros de texto: textos guías para clase (incluye libros de literatura, poesía, etc., requeridos en clase)",104.25,0.0,4.25,4.87,0.0,0.01,nd,,,,,,,,,,,,
2019,6,Total Nacional,09520400,Compra de periódicos,100.3,0.0,0.3,0.31,0.0,0.0,nd,,,,,,,,,,,,
2019,6,Total Nacional,09530100,Material Impreso Diverso,100.15,0.14,0.15,nd,0.0,0.0,nd,,,,,,,,,,,,
2019,6,Total Nacional,09540100,"Artículos De Papelería: Cuadernos, Agendas, Papel Suelto Y En Resmas",100.72,0.37,0.72,1.59,0.0,0.0,nd,,,,,,,,,,,,
2019,6,Total Nacional,09540200,Artículos Para Escribir,100.79,0.32,0.79,1.68,0.0,0.0,nd,,,,,,,,,,,,
2019,6,Total Nacional,09540300,Artículos Para Pintura Y Dibujo,100.52,0.13,0.52,1.41,0.0,0.0,nd,,,,,,,,,,,,
2019,6,Total Nacional,09610300,"Paquetes turísticos completos, incluye paquetes de viajes de excursión realizados durante un día (sin pernoctar)",98.4,3.23,-1.6,1.79,0.02,-0.01,nd,,,,,,,,,,,,
2019,6,Total Nacional,10110400,Educación preescolar y básica primaria,104.58,0.0,4.58,nd,0.0,0.07,nd,,,,,,,,,,,,
2019,6,Total Nacional,10210100,Educación Secundaria,104.75,0.0,4.75,nd,0.0,0.04,nd,,,,,,,,,,,,
2019,6,Total Nacional,10410100,"Inscripciones y matrículas en carreras técnicas, tecnológicas y universitarias",105.37,0.0,5.37,nd,0.0,0.07,nd,,,,,,,,,,,,
2019,6,Total Nacional,10410200,"Inscripciones y matrículas en postgrados (especialización, maestría, doctorado)",104.43,0.0,4.43,nd,0.0,0.01,nd,,,,,,,,,,,,
2019,6,Total Nacional,10419900,Otros gastos en educación superior,103.52,0.0,3.52,nd,0.0,0.0,nd,,,,,,,,,,,,
2019,6,Total Nacional,10510100,Cursos de educación no formal,102.9,0.0,2.9,nd,0.0,0.01,nd,,,,,,,,,,,,
2019,6,Total Nacional,10510400,"Diplomados, educación continuada, preicfes, preuniversitarios",100.03,0.0,0.03,nd,0.0,0.0,nd,,,,,,,,,,,,
2019,6,Total Nacional,10510800,Pagos por asesorías de tareas y clases dictadas por particulares,100.19,0.0,0.19,nd,0.0,0.0,nd,,,,,,,,,,,,
2019,6,Total Nacional,11110100,"Comidas en establecimientos de servicio a la mesa y autoservicio,  medios de transporte, máquinas expendedoras, puestos móviles, y lugares de esparcimiento; se incluyen también las  contratadas por encargo, para llevar y por servicio a domicilio",102.67,0.04,2.67,3.7,0.0,0.17,nd,,,,,,,,,,,,
2019,6,Total Nacional,11110200,"Bebidas calientes : tinto, café con leche, chocolate, té, bebida achocolatada caliente, leche, agua de panela, agua aromática, avena caliente y similares  para consumo inmediato, en establecimientos de servicio a la mesa y autoservicio.",99.51,-2.12,-0.49,1.22,0.0,0.0,nd,,,,,,,,,,,,
2019,6,Total Nacional,11110300,"Gaseosa Y Otros Refrescos  En Establecimientos De Servicio A La Mesa Y Autoservicio,  Medios De Transporte, Maquinas Expendedoras, Puestos Moviles, Y Lugares De Esparcimiento; Se Incluyen Tambien Las Adquiriudas Para Llevar Y Servicio A Domicilio",104.96,0.5,4.96,nd,0.0,0.02,nd,,,,,,,,,,,,
2019,6,Total Nacional,11110400,"Comidas preparadas fuera del hogar para consumo inmediato, en establecimientos de servicio a la mesa y autoservicio,  puestos móviles, lugares de esparcimiento, para llevar y por servicio a domicilio",102.6,0.37,2.6,3.72,0.01,0.05,nd,,,,,,,,,,,,
2019,6,Total Nacional,11110700,"Gastos en discotecas, bares, griles, tabernas, fondas y tiendas dentro y  al aire libre (comida, bebidas, cover)",103.54,0.28,3.54,nd,0.0,0.01,nd,,,,,,,,,,,,
2019,6,Total Nacional,11120100,Pago Por Alimentación En Comedores,104.01,0.0,4.01,nd,0.0,0.0,nd,,,,,,,,,,,,
2019,6,Total Nacional,11210100,"Servicios de alojamiento en hoteles, pensiones, posadas, hostales y moteles; alojamiento en centros de vacaciones y por motivo de enseñanza: internados",99.77,0.64,-0.23,nd,0.0,0.0,nd,,,,,,,,,,,,
2019,6,Total Nacional,12110100,Servicios Prestados En Salones De Peluquería Y Establecimientos De Cuidado Personal,102.95,0.13,2.95,3.84,0.0,0.02,nd,,,,,,,,,,,,
2019,6,Total Nacional,12120100,Aparatos Eléctricos Para El Cuidado Personal Y Su Reparación,101.02,-0.4,1.02,nd,0.0,0.0,nd,,,,,,,,,,,,
2019,6,Total Nacional,12130100,Artículos Para El Cuidado Y La Atención Personal,101.95,0.61,1.95,2.83,0.0,0.0,nd,,,,,,,,,,,,
2019,6,Total Nacional,12130200,Artículos Para Higiene Corporal,102.43,0.34,2.43,2.64,0.01,0.04,nd,,,,,,,,,,,,
2019,6,Total Nacional,12130300,Artículos Para La Higiene Oral,100.87,0.16,0.87,1.39,0.0,0.0,nd,,,,,,,,,,,,
2019,6,Total Nacional,12130400,Productos De Belleza,100.71,0.17,0.71,0.92,0.0,0.0,nd,,,,,,,,,,,,
2019,6,Total Nacional,12139900,Otros Productos Para El Aseo Personal,101.6,0.13,1.6,nd,0.0,0.02,nd,,,,,,,,,,,,
2019,6,Total Nacional,12310100,"Artículos En Oro,  Plata Y Piedras Preciosas Y Su Reparación",102.49,0.3,2.49,1.51,0.0,0.0,nd,,,,,,,,,,,,
2019,6,Total Nacional,12310200,"Relojes, Cronómetros, Termómetros, Barómetros Y Su Reparación",99.96,0.08,-0.04,1.06,0.0,0.0,nd,,,,,,,,,,,,
2019,6,Total Nacional,12310300,Artículos De Fantasía Y Su Reparación,101.38,-0.04,1.38,nd,0.0,0.0,nd,,,,,,,,,,,,
2019,6,Total Nacional,12320100,Artículos De Viaje Y Otros Artículos Para El Transporte De Efectos Personales,99.87,0.09,-0.13,-0.52,0.0,0.0,nd,,,,,,,,,,,,
2019,6,Total Nacional,12320200,Artículos Para Bebés Y Su Reparación,99.57,-0.33,-0.43,nd,0.0,0.0,nd,,,,,,,,,,,,
2019,6,Total Nacional,12320400,"Artículos personales varios como: gafas de sol, lentes de contacto cosméticos, bastones, paraguas y sombrillas, abanicos, llaveros, etc.",101.26,0.0,1.26,nd,0.0,0.0,nd,,,,,,,,,,,,
2019,6,Total Nacional,12410100,Servicios de protección social dentro y fuera del hogar,100.27,0.07,0.27,nd,0.0,0.0,nd,,,,,,,,,,,,
2019,6,Total Nacional,12410200,"Guarderías, salacunas, cuidado de niños fuera del hogar y servicios de adopción",105.33,0.1,5.33,nd,0.0,0.02,nd,,,,,,,,,,,,
2019,6,Total Nacional,12410300,Cuotas moderadoras a EPS,106.17,0.0,6.17,6.17,0.0,0.0,nd,,,,,,,,,,,,
2019,6,Total Nacional,12530100,"Seguros médicos, de accidentes y medicina prepagada",106.62,0.06,6.62,7.05,0.0,0.01,nd,,,,,,,,,,,,
2019,6,Total Nacional,12540100,Seguros De Vehículos Y Otros Relacionados Con El Transporte,96.96,-1.92,-3.04,-6.83,0.0,0.0,nd,,,,,,,,,,,,
2019,6,Total Nacional,12620400,Servicios auxiliares y  financieros prestados a cambio de una comisión explicita,103.77,0.0,3.77,nd,0.0,0.01,nd,,,,,,,,,,,,
2019,6,Total Nacional,12710500,"Certificados, documentos administrativos y pago de honorarios",101.69,0.0,1.69,nd,0.0,0.0,nd,,,,,,,,,,,,
2019,6,Total Nacional,12719900,Otros pagos por servicios,102.29,0.87,2.29,nd,0.0,0.0,nd,,,,,,,,,,,,
2019,3,Total Nacional,01110100,Arroz,101.29,0.07,1.29,4.49,0.0,0.01,nd,,,,,,,,,,,,
2019,3,Total Nacional,01110200,Pastas Alimenticias,100.71,0.08,0.71,0.6,0.0,0.0,nd,,,,,,,,,,,,
2019,3,Total Nacional,01110300,Avena Y Sus Derivados,96.84,-0.79,-3.16,-3.62,0.0,0.0,nd,,,,,,,,,,,,
2019,3,Total Nacional,01110500,Trigo Y Sus Derivados,99.62,-0.3,-0.38,1.63,0.0,0.0,nd,,,,,,,,,,,,
2019,3,Total Nacional,01110600,Maíz Y Sus Derivados,99.08,-0.21,-0.92,1.08,0.0,0.0,nd,,,,,,,,,,,,
2019,3,Total Nacional,01110800,Pan,101.1,0.15,1.1,2.3,0.0,0.01,nd,,,,,,,,,,,,
2019,3,Total Nacional,01119800,"Otras Harinas, Cereales Y Almidones",101.57,-0.01,1.57,3.19,0.0,0.0,nd,,,,,,,,,,,,
2019,3,Total Nacional,01119900,Otros Productos De Panadería,100.04,-0.05,0.04,1.04,0.0,0.0,nd,,,,,,,,,,,,
2019,3,Total Nacional,01120100,Carne De Res Y Derivados,100.84,0.29,0.84,1.6,0.01,0.02,nd,,,,,,,,,,,,
2019,3,Total Nacional,01120200,Carne De Cerdo Y Derivados,100.8,-0.27,0.8,-1.11,0.0,0.0,nd,,,,,,,,,,,,
2019,3,Total Nacional,01120300,Carne De Aves,101.21,0.36,1.21,2.06,0.0,0.01,nd,,,,,,,,,,,,
2019,3,Total Nacional,01120500,"Carnes Preparadas, Charcutería Y Otros Productos Conteniendo Carne",100.3,0.12,0.3,1.25,0.0,0.0,nd,,,,,,,,,,,,
2019,3,Total Nacional,01130300,Productos de rio y mar (incluye pescados y camarones frescos o congelados y pescado enlatado como sardinas y atún),102.11,0.59,2.11,4.26,0.0,0.01,nd,,,,,,,,,,,,
2019,3,Total Nacional,01140100,Leche,101.32,0.62,1.32,1.45,0.01,0.01,nd,,,,,,,,,,,,
2019,3,Total Nacional,01140200,Quesos Y Productos Afines,103.77,0.95,3.77,6.97,0.0,0.02,nd,,,,,,,,,,,,
2019,3,Total Nacional,01140500,Huevos,101.21,1.12,1.21,7.85,0.01,0.01,nd,,,,,,,,,,,,
2019,3,Total Nacional,01149900,Otros Derivados De La Leche,100.98,0.21,0.98,2.32,0.0,0.0,nd,,,,,,,,,,,,
2019,3,Total Nacional,01150100,Aceites Comestibles,101.04,0.14,1.04,3.44,0.0,0.0,nd,,,,,,,,,,,,
2019,3,Total Nacional,01150200,Mantequilla De Vaca,103.17,1.62,3.17,4.53,0.0,0.0,nd,,,,,,,,,,,,
2019,3,Total Nacional,01150500,Margarinas y grasas animales y vegetales,100.14,-0.65,0.14,-1.25,0.0,0.0,nd,,,,,,,,,,,,
2019,3,Total Nacional,01160200,Frutas Congeladas O En Pulpa,100.27,-0.23,0.27,nd,0.0,0.0,nd,,,,,,,,,,,,
2019,3,Total Nacional,01160300,"Frutos Secos Y Nueces, Cáscaras De Frutas Y Semillas Comestibles",100.48,-0.12,0.48,nd,0.0,0.0,nd,,,,,,,,,,,,
2019,3,Total Nacional,01160500,Naranjas,110.85,2.61,10.85,-0.14,0.0,0.01,nd,,,,,,,,,,,,
2019,3,Total Nacional,01160600,Bananos,99.46,3.01,-0.54,-1.52,0.0,0.0,nd,,,,,,,,,,,,
2019,3,Total Nacional,01160700,Tomate de árbol,100.05,3.04,0.05,1.58,0.0,0.0,nd,,,,,,,,,,,,
2019,3,Total Nacional,01160800,Moras,107.34,4.75,7.34,-0.05,0.0,0.0,nd,,,,,,,,,,,,
2019,3,Total Nacional,01160900,Frutas frescas,118.79,10.17,18.79,17.93,0.08,0.13,nd,,,,,,,,,,,,
2019,3,Total Nacional,01170200,Legumbres Secas,97.99,-1.51,-2.01,-1.9,0.0,0.0,nd,,,,,,,,,,,,
2019,3,Total Nacional,01170300,Legumbres Y Hortalizas En Conserva Y Deshidratadas,98.48,-0.32,-1.52,-2.52,0.0,0.0,nd,,,,,,,,,,,,
2019,3,Total Nacional,01170400,Plátanos,104.48,7.24,4.48,9.91,0.02,0.01,nd,,,,,,,,,,,,
2019,3,Total Nacional,01170500,Papas,116.4,6.52,16.4,7.14,0.02,0.05,nd,,,,,,,,,,,,
2019,3,Total Nacional,01170600,Yuca Para Consumo En El Hogar,102.34,2.02,2.34,47.06,0.0,0.0,nd,,,,,,,,,,,,
2019,3,Total Nacional,01171100,"Productos Derivados De Los Tubérculos, Raíces Y Plátanos",100.73,-0.11,0.73,nd,0.0,0.0,nd,,,,,,,,,,,,
2019,3,Total Nacional,01171200,"Arracacha, ñame y otros tubérculos",100.12,-0.32,0.12,26.76,0.0,0.0,nd,,,,,,,,,,,,
2019,3,Total Nacional,01171300,Tomate,94.28,-4.16,-5.72,-23.73,-0.01,-0.01,nd,,,,,,,,,,,,
2019,3,Total Nacional,01171400,Cebolla,105.93,-5.2,5.93,23.38,-0.01,0.01,nd,,,,,,,,,,,,
2019,3,Total Nacional,01171500,Zanahoria,115.45,-8.09,15.45,-34.83,0.0,0.01,nd,,,,,,,,,,,,
