0,1,2,3,4,5,6,7,8,9,10,11,12,13,14,15,16,17,18,19,20,21,22,23
2019,4,Total Nacional,01110100,Arroz,101.41,0.12,1.41,3.05,0.0,0.01,nd,,,,,,,,,,,,
2019,4,Total Nacional,01110200,Pastas Alimenticias,100.85,0.13,0.85,0.78,0.0,0.0,nd,,,,,,,,,,,,
2019,4,Total Nacional,01110300,Avena Y Sus Derivados,96.49,-0.36,-3.51,-4.23,0.0,0.0,nd,,,,,,,,,,,,
2019,4,Total Nacional,01110500,Trigo Y Sus Derivados,100.26,0.65,0.26,1.22,0.0,0.0,nd,,,,,,,,,,,,
2019,4,Total Nacional,01110600,Maíz Y Sus Derivados,99.76,0.69,-0.24,0.71,0.0,0.0,nd,,,,,,,,,,,,
2019,4,Total Nacional,01110800,Pan,101.27,0.17,1.27,2.09,0.0,0.01,nd,,,,,,,,,,,,
2019,4,Total Nacional,01119800,"Otras Harinas, Cereales Y Almidones",102.55,0.97,2.55,3.39,0.0,0.01,nd,,,,,,,,,,,,
2019,4,Total Nacional,01119900,Otros Productos De Panadería,100.34,0.3,0.34,0.79,0.0,0.0,nd,,,,,,,,,,,,
2019,4,Total Nacional,01120100,Carne De Res Y Derivados,101.2,0.36,1.2,1.22,0.01,0.02,nd,,,,,,,,,,,,
2019,4,Total Nacional,01120200,Carne De Cerdo Y Derivados,100.6,-0.2,0.6,-1.66,0.0,0.0,nd,,,,,,,,,,,,
2019,4,Total Nacional,01120300,Carne De Aves,101.64,0.43,1.64,1.16,0.01,0.02,nd,,,,,,,,,,,,
2019,4,Total Nacional,01120500,"Carnes Preparadas, Charcutería Y Otros Productos Conteniendo Carne",100.58,0.28,0.58,1.86,0.0,0.0,nd,,,,,,,,,,,,
2019,4,Total Nacional,01130300,Productos de rio y mar (incluye pescados y camarones frescos o congelados y pescado enlatado como sardinas y atún),102.75,0.63,2.75,4.73,0.0,0.02,nd,,,,,,,,,,,,
2019,4,Total Nacional,01140100,Leche,101.64,0.32,1.64,1.61,0.0,0.02,nd,,,,,,,,,,,,
2019,4,Total Nacional,01140200,Quesos Y Productos Afines,105.19,1.37,5.19,7.37,0.01,0.02,nd,,,,,,,,,,,,
2019,4,Total Nacional,01140500,Huevos,102.35,1.13,2.35,8.9,0.01,0.02,nd,,,,,,,,,,,,
2019,4,Total Nacional,01149900,Otros Derivados De La Leche,101.32,0.34,1.32,2.28,0.0,0.0,nd,,,,,,,,,,,,
2019,4,Total Nacional,01150100,Aceites Comestibles,101.33,0.28,1.33,3.16,0.0,0.01,nd,,,,,,,,,,,,
2019,4,Total Nacional,01150200,Mantequilla De Vaca,103.94,0.75,3.94,4.92,0.0,0.0,nd,,,,,,,,,,,,
2019,4,Total Nacional,01150500,Margarinas y grasas animales y vegetales,101.09,0.96,1.09,-0.03,0.0,0.0,nd,,,,,,,,,,,,
2019,4,Total Nacional,01160200,Frutas Congeladas O En Pulpa,100.19,-0.08,0.19,nd,0.0,0.0,nd,,,,,,,,,,,,
2019,4,Total Nacional,01160300,"Frutos Secos Y Nueces, Cáscaras De Frutas Y Semillas Comestibles",100.9,0.42,0.9,nd,0.0,0.0,nd,,,,,,,,,,,,
2019,4,Total Nacional,01160500,Naranjas,113.49,2.38,13.49,0.03,0.0,0.01,nd,,,,,,,,,,,,
2019,4,Total Nacional,01160600,Bananos,103.08,3.65,3.08,-1.06,0.0,0.0,nd,,,,,,,,,,,,
2019,4,Total Nacional,01160700,Tomate de árbol,102.45,2.4,2.45,-2.73,0.0,0.0,nd,,,,,,,,,,,,
2019,4,Total Nacional,01160800,Moras,119.19,11.04,19.19,7.34,0.01,0.01,nd,,,,,,,,,,,,
2019,4,Total Nacional,01160900,Frutas frescas,119.68,0.75,19.68,16.31,0.01,0.14,nd,,,,,,,,,,,,
2019,4,Total Nacional,01170200,Legumbres Secas,97.43,-0.57,-2.57,-2.9,0.0,-0.01,nd,,,,,,,,,,,,
2019,4,Total Nacional,01170300,Legumbres Y Hortalizas En Conserva Y Deshidratadas,100.23,1.78,0.23,-1.03,0.0,0.0,nd,,,,,,,,,,,,
2019,4,Total Nacional,01170400,Plátanos,112.68,7.85,12.68,19.88,0.03,0.04,nd,,,,,,,,,,,,
2019,4,Total Nacional,01170500,Papas,126.4,8.59,26.4,14.9,0.03,0.08,nd,,,,,,,,,,,,
2019,4,Total Nacional,01170600,Yuca Para Consumo En El Hogar,110.2,7.68,10.2,54.21,0.01,0.01,nd,,,,,,,,,,,,
2019,4,Total Nacional,01171100,"Productos Derivados De Los Tubérculos, Raíces Y Plátanos",101.35,0.61,1.35,nd,0.0,0.0,nd,,,,,,,,,,,,
2019,4,Total Nacional,01171200,"Arracacha, ñame y otros tubérculos",112.62,12.48,12.62,34.05,0.0,0.0,nd,,,,,,,,,,,,
2019,4,Total Nacional,01171300,Tomate,102.07,8.26,2.07,-28.79,0.01,0.0,nd,,,,,,,,,,,,
2019,4,Total Nacional,01171400,Cebolla,105.17,-0.72,5.17,25.99,0.0,0.01,nd,,,,,,,,,,,,
2019,4,Total Nacional,01171500,Zanahoria,107.06,-7.26,7.06,-33.17,0.0,0.0,nd,,,,,,,,,,,,
2019,4,Total Nacional,01171600,Hortalizas y legumbres frescas ,111.06,4.04,11.06,8.15,0.01,0.04,nd,,,,,,,,,,,,
2019,4,Total Nacional,01180100,Azúcar Y Otros Endulzantes,102.04,1.94,2.04,-2.26,0.0,0.01,nd,,,,,,,,,,,,
2019,4,Total Nacional,01180200,Panela Cruda Para Consumo En El Hogar,98.44,-0.63,-1.56,-11.04,0.0,0.0,nd,,,,,,,,,,,,
2019,4,Total Nacional,01180300,"Jaleas, Mermeladas, Miel Y Similares",100.98,0.3,0.98,0.57,0.0,0.0,nd,,,,,,,,,,,,
2019,4,Total Nacional,01180500,"Dulces, Confites, Caramelos, Bombones, Chocolatinas, Chicles, Masmelos, Cocadas Para Consumo En El Hogar",102.68,0.41,2.68,1.94,0.0,0.0,nd,,,,,,,,,,,,
2019,4,Total Nacional,01180600,"Helados, Conos, Paletas, Vasitos, Refrescos Congelados Y Tortas Heladas Para Consumo En El Hogar",101.53,0.86,1.53,nd,0.0,0.0,nd,,,,,,,,,,,,
2019,4,Total Nacional,01180700,"Gelatinas, Flanes Y Pudines En Polvo Para Preparar",100.26,-0.17,0.26,-0.46,0.0,0.0,nd,,,,,,,,,,,,
2019,4,Total Nacional,01190100,"Salsas, Pastas Y Aderezos",100.44,0.3,0.44,1.01,0.0,0.0,nd,,,,,,,,,,,,
2019,4,Total Nacional,01190200,Sal,101.85,0.54,1.85,7.08,0.0,0.0,nd,,,,,,,,,,,,
2019,4,Total Nacional,01190500,"Sopas, Cremas, Caldos Y Consomés",101.02,0.93,1.02,-1.84,0.0,0.0,nd,,,,,,,,,,,,
2019,4,Total Nacional,01190600,"Frituras: papas fritas, chitos, maizitos, patacones, besitos, etc., para consumo en el hogar",101.75,1.1,1.75,1.54,0.0,0.0,nd,,,,,,,,,,,,
2019,4,Total Nacional,01190800,Condimentos y hierbas culinarias,102.29,-3.41,2.29,nd,0.0,0.0,nd,,,,,,,,,,,,
2019,4,Total Nacional,01191100,Leche En Polvo Para Lactantes,100.73,0.61,0.73,0.7,0.0,0.0,nd,,,,,,,,,,,,
2019,4,Total Nacional,01199900,"Otros Alimentos Precocidos Y Preparados: Ajiaco, Lenteja, Frijol, Lechona Enlatada Y Similares",100.75,0.59,0.75,nd,0.0,0.0,nd,,,,,,,,,,,,
2019,4,Total Nacional,01210100,Café Y Productos A Base De Café,101.06,0.16,1.06,1.56,0.0,0.0,nd,,,,,,,,,,,,
2019,4,Total Nacional,01210200,Chocolate Y Productos A Base De Chocolate,100.1,0.1,0.1,-0.18,0.0,0.0,nd,,,,,,,,,,,,
2019,4,Total Nacional,01210300,Té E Infusiones (Para Bebidas Calientes),100.83,0.22,0.83,nd,0.0,0.0,nd,,,,,,,,,,,,
2019,4,Total Nacional,01220100,Agua Mineral (Con Y Sin Gas) Para Consumo En El Hogar,103.38,0.68,3.38,2.6,0.0,0.0,nd,,,,,,,,,,,,
2019,4,Total Nacional,01220600,"Refrescos Líquidos Empacados (Jugos, Té Fríos Y Bebidas Hidratantes)",101.11,0.01,1.11,1.49,0.0,0.0,nd,,,,,,,,,,,,
2019,4,Total Nacional,01220700,Concentrados Para Preparar Refrescos,100.53,0.37,0.53,0.9,0.0,0.0,nd,,,,,,,,,,,,
2019,4,Total Nacional,01221100,Gaseosas y maltas para consumo en el hogar,105.76,0.82,5.76,7,0.0,0.03,nd,,,,,,,,,,,,
2019,4,Total Nacional,01221200,"Bebidas energizantes y a base de arroz, soya, coco y similares",101.82,0.25,1.82,nd,0.0,0.0,nd,,,,,,,,,,,,
2019,4,Total Nacional,02110100,Aguardiente,109.83,3.59,9.83,10.5,0.01,0.01,nd,,,,,,,,,,,,
2019,4,Total Nacional,02110500,"Whisky, ron, brandy, vodka, ginebra, coñac, tequila, cremas de licor y aperitivos",104.78,2.16,4.78,5.18,0.01,0.02,nd,,,,,,,,,,,,
2019,4,Total Nacional,02120100,"Vino, Champaña, Jerez Y Aperitivos A Base De Vino Para Consumo En El Hogar",103.96,1.87,3.96,4.36,0.0,0.0,nd,,,,,,,,,,,,
2019,4,Total Nacional,02130100,Cerveza Y Refajo,100.94,-0.24,0.94,3.27,0.0,0.01,nd,,,,,,,,,,,,
2019,4,Total Nacional,02210100,"Cigarrillos, tabaco y derivados",110.44,1.49,10.44,14.54,0.0,0.01,nd,,,,,,,,,,,,
2019,4,Total Nacional,03120100,Prendas De Vestir Para Hombre,99.87,0.3,-0.13,0.27,0.0,0.0,nd,,,,,,,,,,,,
2019,4,Total Nacional,03120200,Prendas De Vestir Para Mujer,99.07,-0.17,-0.93,-0.83,0.0,-0.01,nd,,,,,,,,,,,,
2019,4,Total Nacional,03120500,Prendas De Vestir Para Bebés,100.25,0.11,0.25,0.39,0.0,0.0,nd,,,,,,,,,,,,
2019,4,Total Nacional,03120600,Uniformes,103.41,0.0,3.41,3.99,0.0,0.01,nd,,,,,,,,,,,,
2019,4,Total Nacional,03120700,Prendas de vestir para niña y niño,99.95,0.03,-0.05,0.64,0.0,0.0,nd,,,,,,,,,,,,
2019,4,Total Nacional,03131000,"Otros artículos y accesorios de vestir para hombre y mujer, incluyendo artículos de vestir para adulto y bebé y materiales",100.9,0.19,0.9,0.91,0.0,0.0,nd,,,,,,,,,,,,
2019,4,Total Nacional,03140200,Lavado Y Planchado De Ropa,101.84,0.39,1.84,2.8,0.0,0.0,nd,,,,,,,,,,,,
2019,4,Total Nacional,03210100,Calzado Para Hombre,99.76,0.18,-0.24,-0.36,0.0,0.0,nd,,,,,,,,,,,,
2019,4,Total Nacional,03210200,Calzado Para Mujer,100.32,0.11,0.32,0.19,0.0,0.0,nd,,,,,,,,,,,,
2019,4,Total Nacional,03210700,Calzado para niño y niña,99.87,-0.04,-0.13,-0.6,0.0,0.0,nd,,,,,,,,,,,,
2019,4,Total Nacional,04130100,Arriendo efectivo ,101.19,0.36,1.19,3.07,0.04,0.13,nd,,,,,,,,,,,,
2019,4,Total Nacional,04230100,Arriendo imputado,101.16,0.31,1.16,3.15,0.04,0.17,nd,,,,,,,,,,,,
2019,4,Total Nacional,04310100,Materiales Para La Conservación Y La Reparación De La Vivienda,100.6,0.18,0.6,nd,0.0,0.0,nd,,,,,,,,,,,,
2019,4,Total Nacional,04410100,Suministro De Agua,101.81,0.12,1.81,4.85,0.0,0.03,nd,,,,,,,,,,,,
2019,4,Total Nacional,04420100,Recogida De Basuras,104.28,0.91,4.28,7.4,0.0,0.02,nd,,,,,,,,,,,,
2019,4,Total Nacional,04430100,Alcantarillado,106.54,0.51,6.54,9.73,0.0,0.03,nd,,,,,,,,,,,,
2019,4,Total Nacional,04440100,Servicios Relacionados Con La Copropiedad,103.2,1.22,3.2,4.49,0.01,0.04,nd,,,,,,,,,,,,
2019,4,Total Nacional,04510100,Electricidad,104.41,2.22,4.41,8.23,0.07,0.13,nd,,,,,,,,,,,,
2019,4,Total Nacional,04520300,Gas,100.92,-1.6,0.92,7.09,-0.02,0.01,nd,,,,,,,,,,,,
2019,4,Total Nacional,05110100,Muebles,100.66,0.34,0.66,nd,0.0,0.0,nd,,,,,,,,,,,,
2019,4,Total Nacional,05110200,Equipo De Iluminación,100.18,0.44,0.18,nd,0.0,0.0,nd,,,,,,,,,,,,
2019,4,Total Nacional,05119900,Otros Artículos De Decoración,99.93,0.0,-0.07,nd,0.0,0.0,nd,,,,,,,,,,,,
2019,4,Total Nacional,05210200,Ropa confeccionada para cama,100.97,0.19,0.97,0.99,0.0,0.0,nd,,,,,,,,,,,,
2019,4,Total Nacional,05210700,Ropa de tocador y productos textiles del hogar,100.7,0.36,0.7,1.97,0.0,0.0,nd,,,,,,,,,,,,
2019,4,Total Nacional,05310100,"Neveras, Refrigeradores Y Congeladores",102.02,0.88,2.02,2.5,0.0,0.0,nd,,,,,,,,,,,,
2019,4,Total Nacional,05310200,"Lavadoras, Secadoras Y Lava-Vajillas",102.27,0.25,2.27,0.42,0.0,0.0,nd,,,,,,,,,,,,
2019,4,Total Nacional,05310300,"Estufas, Hornos Y Pipetas De Gas",102.13,0.49,2.13,1.81,0.0,0.0,nd,,,,,,,,,,,,
2019,4,Total Nacional,05320100,Aparatos Eléctricos  Pequeños Para El Hogar,101.2,0.39,1.2,nd,0.0,0.0,nd,,,,,,,,,,,,
2019,4,Total Nacional,05410100,"Cristalería y vajilla Artículos, vajillas y utensilios de vidrio, cristal, porcelana y cerámica para el hogar",101.55,0.51,1.55,3.03,0.0,0.0,nd,,,,,,,,,,,,
2019,4,Total Nacional,05410300,Utensilios de cocina y menaje no eléctricos,100.21,0.16,0.21,1,0.0,0.0,nd,,,,,,,,,,,,
2019,4,Total Nacional,05520300,Accesorios Eléctricos Pequeños,99.35,-0.33,-0.65,-0.8,0.0,0.0,nd,,,,,,,,,,,,
2019,4,Total Nacional,05610100,Productos De Limpieza Y Mantenimiento,101.53,0.55,1.53,1.75,0.01,0.02,nd,,,,,,,,,,,,
2019,4,Total Nacional,05610200,Elementos De Aseo,102.41,0.89,2.41,3.13,0.0,0.0,nd,,,,,,,,,,,,
2019,4,Total Nacional,05610400,"Artículos De Ferretería: Puntillas, Clavos, Tornillos, Tuercas, Brocas, Brochas, Pinceles, Lijas Y Otros.",100.46,0.02,0.46,nd,0.0,0.0,nd,,,,,,,,,,,,
2019,4,Total Nacional,05610600,Productos desechables y no duraderos para el hogar,100.88,0.16,0.88,nd,0.0,0.0,nd,,,,,,,,,,,,
2019,4,Total Nacional,05620100,Servicio Doméstico,102.96,0.5,2.96,4.24,0.01,0.03,nd,,,,,,,,,,,,
2019,4,Total Nacional,06110300,Productos farmacéuticos y dermatológicos,100.09,0.25,0.09,1.12,0.0,0.0,nd,,,,,,,,,,,,
2019,4,Total Nacional,06120100,Elementos Implementos Médicos,100.09,-0.41,0.09,nd,0.0,0.0,nd,,,,,,,,,,,,
2019,4,Total Nacional,06130100,Artefactos Y Equipo Terapéutico Y Su Reparación,101.52,0.53,1.52,3.35,0.0,0.0,nd,,,,,,,,,,,,
2019,4,Total Nacional,06210100,Consulta Médica General Con Médico Particular,103.53,0.57,3.53,4.67,0.0,0.0,nd,,,,,,,,,,,,
2019,4,Total Nacional,06210500,"Consulta médica con médico especialista particular (incluye ortodoncia): pediatría, oftalmología, ginecología, siquiatría, traumatología, cardiología y otros especialistas",102.52,0.7,2.52,3.65,0.0,0.0,nd,,,,,,,,,,,,
2019,4,Total Nacional,06220100,"Servicios Odontológicos Con Odontólogos Particulares: Consultas, Profilaxis, Exodoncias (Extracción), Amalgamas, Sellantes, Fluorización.",101.81,0.34,1.81,2.93,0.0,0.0,nd,,,,,,,,,,,,
2019,4,Total Nacional,06230100,"Servicios Para Particulares En Centros De Rayos X: Radiografías (Incluyendo Las Dentales), Urografías, Mamografías, Electrocardiogramas Y Otras Imágenes Diagnósticas",102.78,0.13,2.78,3.69,0.0,0.0,nd,,,,,,,,,,,,
2019,4,Total Nacional,06230200,"Exámenes De Laboratorio Para Particulares: De Sangre, Bacteriológicos, Etc.",102.08,0.1,2.08,2.83,0.0,0.0,nd,,,,,,,,,,,,
2019,4,Total Nacional,06230300,Servicios Médicos Auxiliares No Hospitalarios,101.46,0.04,1.46,nd,0.0,0.0,nd,,,,,,,,,,,,
2019,4,Total Nacional,06310300,"Servicios médicos menores (pequeña cirugía, cirugía ambulatoria, urgencias, etc.)",100.44,0.0,0.44,0.96,0.0,0.0,nd,,,,,,,,,,,,
2019,4,Total Nacional,07110100,Vehículo Particular Nuevo O Usado,100.85,0.18,0.85,0.67,0.0,0.02,nd,,,,,,,,,,,,
2019,4,Total Nacional,07120100,Motos Y Bicicletas Con Motor Nuevas O Usadas,101.54,0.26,1.54,0.85,0.0,0.0,nd,,,,,,,,,,,,
2019,4,Total Nacional,07130100,Compra De Bicicletas Nuevas O Usadas (Excepto Para Niños),101.38,-0.19,1.38,2.82,0.0,0.0,nd,,,,,,,,,,,,
2019,4,Total Nacional,07210100,"Llantas Y Neumáticos, Rines Para Vehículo",103.15,0.7,3.15,4.65,0.0,0.0,nd,,,,,,,,,,,,
2019,4,Total Nacional,07210300,"Productos Para La Limpieza Y Conservación Del  Vehículo: Pintura, Limpiadores, Selladores, Shampoo, Ceras, Ambientadores, Eliminador De Olores, Pañitos Húmedos Para Vehículos, Etc.",100.38,0.02,0.38,nd,0.0,0.0,nd,,,,,,,,,,,,
2019,4,Total Nacional,07210600,"Piezas Para Bicicleta: Llantas, Neumáticos, Rines, Manzanas, Cadenas, Cambios, Piñones, Guallas, Sillines, Candados Y Cable Candado, Luces, Etc.",103.74,0.56,3.74,nd,0.0,0.0,nd,,,,,,,,,,,,
2019,4,Total Nacional,07219900,Otras Piezas De Repuesto Para Vehículo,101.84,0.25,1.84,3.58,0.0,0.0,nd,,,,,,,,,,,,
2019,4,Total Nacional,07220400,"Aditivos, Valvulinas, Líquido Para Frenos, Refrigerantes, Agua Para Batería, Etc.",99.96,-0.04,-0.04,nd,0.0,0.0,nd,,,,,,,,,,,,
2019,4,Total Nacional,07220500,Combustibles para vehículos,100.32,0.14,0.32,5.99,0.0,0.01,nd,,,,,,,,,,,,
2019,4,Total Nacional,07230100,"Mantenimiento Y Reparaciones Efectuadas En El Taller: Engrase, Sincronización, Revisiones Técnicas, Instalaciones De Partes Y Accesorios, Balanceo De Ruedas, Despinchada, Lavado Y Polichado, Servicios De Grúa, Etc.",101.58,0.3,1.58,2.92,0.0,0.01,nd,,,,,,,,,,,,
2019,4,Total Nacional,07230200,Compra Y Cambio De Aceite,102.21,0.53,2.21,2.76,0.0,0.0,nd,,,,,,,,,,,,
2019,4,Total Nacional,07230300,Servicios De Latonería Y Pintura,100.15,0.05,0.15,nd,0.0,0.0,nd,,,,,,,,,,,,
2019,4,Total Nacional,07240100,Parqueaderos,102.39,0.75,2.39,3.5,0.0,0.01,nd,,,,,,,,,,,,
2019,4,Total Nacional,07240200,Peajes,102.95,0.0,2.95,nd,0.0,0.0,nd,,,,,,,,,,,,
2019,4,Total Nacional,07240300,"Gastos Reglamentarios Relacionados Con La Propiedad, Manejo Y Alquiler De Vehículos",105.58,0.05,5.58,nd,0.0,0.01,nd,,,,,,,,,,,,
2019,4,Total Nacional,07330100,Transporte De Pasajeros Y Equipaje En Avión (Incluye Pagos Por Exceso De Equipaje),96.57,-0.65,-3.43,-3.24,0.0,-0.01,nd,,,,,,,,,,,,
2019,4,Total Nacional,07371000,Transporte urbano  (incluye tren y metro),103.58,0.18,3.58,4.17,0.01,0.16,nd,,,,,,,,,,,,
2019,4,Total Nacional,07372000,"Transporte intermunicipal, interveredal e internacional",95.81,2.48,-4.19,3.72,0.01,-0.01,nd,,,,,,,,,,,,
2019,4,Total Nacional,07373000,Transporte escolar,103.71,0.0,3.71,4.28,0.0,0.01,nd,,,,,,,,,,,,
2019,4,Total Nacional,08210200,"Equipos de telefonía móvil, similares y reparación",95.69,0.1,-4.31,-17.17,0.0,-0.02,nd,,,,,,,,,,,,
2019,4,Total Nacional,08310400,Servicios de comunicación fija y móvil y provisión a internet,102.49,0.77,2.49,2.63,0.03,0.1,nd,,,,,,,,,,,,
2019,4,Total Nacional,09110100,"Equipo Para La Recepción, Grabación Y Reproducción De Sonido Únicamente",98.66,-0.21,-1.34,-2.53,0.0,0.0,nd,,,,,,,,,,,,
2019,4,Total Nacional,09110200,"Equipo Para La Grabación, Recepción Y Reproducción  De Imagen Y Sonido",97.34,-0.45,-2.66,-8.15,0.0,-0.01,nd,,,,,,,,,,,,
2019,4,Total Nacional,09130100,Aparatos De Procesamiento De Información Y Hardware,98.98,1.55,-1.02,-7.35,0.0,0.0,nd,,,,,,,,,,,,
2019,4,Total Nacional,09310200,Juegos Y Juguetes Infantiles,100.71,0.13,0.71,nd,0.0,0.0,nd,,,,,,,,,,,,
2019,4,Total Nacional,09310300,"Artículos, Adornos Y Prendas De Vestir Para Fiestas",101.03,0.7,1.03,nd,0.0,0.0,nd,,,,,,,,,,,,
2019,4,Total Nacional,09330200,"Plantas Naturales: Ramos De Flores, Matas, Arbustos",100.19,0.26,0.19,-0.7,0.0,0.0,nd,,,,,,,,,,,,
2019,4,Total Nacional,09340200,Alimentos Para Animales Domésticos Y Mascotas,104.64,1.06,4.64,3.7,0.0,0.01,nd,,,,,,,,,,,,
2019,4,Total Nacional,09340300,"Productos  Para Animales Domésticos Y Mascotas, Productos De Veterinaria, Artículos Para El Cuidado E Higiene (Shampoo, Jabón, Desodorantes) Y Accesorios Para Mascotas (Collares, Perrera, Jaula, Acuarios Y Otros)",100.4,0.11,0.4,nd,0.0,0.0,nd,,,,,,,,,,,,
2019,4,Total Nacional,09350100,"Servicios De Veterinaria Y De Otro Tipo Para Animales Domésticos: Cuidado, Salón De Belleza, Alojamiento, Entrenamiento, Paseadores De Perros Y Colegios Para Mascotas Etc.",102.99,0.74,2.99,4.57,0.0,0.0,nd,,,,,,,,,,,,
2019,4,Total Nacional,09410100,Servicios Recreativos,101.59,-1.34,1.59,7.15,0.0,0.0,nd,,,,,,,,,,,,
2019,4,Total Nacional,09410200,Servicios Prestados Por Escenarios Deportivos,102.4,1.01,2.4,8,0.0,0.0,nd,,,,,,,,,,,,
2019,4,Total Nacional,09420100,Cines Y Teatros,103.39,2.46,3.39,7.02,0.01,0.01,nd,,,,,,,,,,,,
2019,4,Total Nacional,09420600,Suscripción y servicio de televisión por redes y cable ,102.74,1.56,2.74,3.42,0.01,0.02,nd,,,,,,,,,,,,
2019,4,Total Nacional,09510100,Libros Y Lista De Útiles Escolares Completa,100.14,0.05,0.14,nd,0.0,0.0,nd,,,,,,,,,,,,
2019,4,Total Nacional,09510200,"Libros de texto: textos guías para clase (incluye libros de literatura, poesía, etc., requeridos en clase)",104.25,0.0,4.25,4.87,0.0,0.01,nd,,,,,,,,,,,,
2019,4,Total Nacional,09520400,Compra de periódicos,100.21,0.03,0.21,0.22,0.0,0.0,nd,,,,,,,,,,,,
2019,4,Total Nacional,09530100,Material Impreso Diverso,100.0,0.0,0.0,nd,0.0,0.0,nd,,,,,,,,,,,,
2019,4,Total Nacional,09540100,"Artículos De Papelería: Cuadernos, Agendas, Papel Suelto Y En Resmas",100.27,-0.32,0.27,1.24,0.0,0.0,nd,,,,,,,,,,,,
2019,4,Total Nacional,09540200,Artículos Para Escribir,100.36,-0.1,0.36,1.83,0.0,0.0,nd,,,,,,,,,,,,
2019,4,Total Nacional,09540300,Artículos Para Pintura Y Dibujo,100.21,-0.1,0.21,1.68,0.0,0.0,nd,,,,,,,,,,,,
2019,4,Total Nacional,09610300,"Paquetes turísticos completos, incluye paquetes de viajes de excursión realizados durante un día (sin pernoctar)",95.59,-2.1,-4.41,-2.43,-0.01,-0.03,nd,,,,,,,,,,,,
2019,4,Total Nacional,10110400,Educación preescolar y básica primaria,104.58,0.0,4.58,nd,0.0,0.07,nd,,,,,,,,,,,,
2019,4,Total Nacional,10210100,Educación Secundaria,104.75,0.0,4.75,nd,0.0,0.04,nd,,,,,,,,,,,,
2019,4,Total Nacional,10410100,"Inscripciones y matrículas en carreras técnicas, tecnológicas y universitarias",105.22,0.23,5.22,nd,0.0,0.07,nd,,,,,,,,,,,,
2019,4,Total Nacional,10410200,"Inscripciones y matrículas en postgrados (especialización, maestría, doctorado)",104.25,0.3,4.25,nd,0.0,0.01,nd,,,,,,,,,,,,
2019,4,Total Nacional,10419900,Otros gastos en educación superior,103.5,0.06,3.5,nd,0.0,0.0,nd,,,,,,,,,,,,
2019,4,Total Nacional,10510100,Cursos de educación no formal,102.9,0.0,2.9,nd,0.0,0.01,nd,,,,,,,,,,,,
2019,4,Total Nacional,10510400,"Diplomados, educación continuada, preicfes, preuniversitarios",100.03,0.0,0.03,nd,0.0,0.0,nd,,,,,,,,,,,,
2019,4,Total Nacional,10510800,Pagos por asesorías de tareas y clases dictadas por particulares,100.19,0.0,0.19,nd,0.0,0.0,nd,,,,,,,,,,,,
2019,4,Total Nacional,11110100,"Comidas en establecimientos de servicio a la mesa y autoservicio,  medios de transporte, máquinas expendedoras, puestos móviles, y lugares de esparcimiento; se incluyen también las  contratadas por encargo, para llevar y por servicio a domicilio",102.58,0.54,2.58,3.68,0.03,0.16,nd,,,,,,,,,,,,
2019,4,Total Nacional,11110200,"Bebidas calientes : tinto, café con leche, chocolate, té, bebida achocolatada caliente, leche, agua de panela, agua aromática, avena caliente y similares  para consumo inmediato, en establecimientos de servicio a la mesa y autoservicio.",101.99,0.07,1.99,4.34,0.0,0.0,nd,,,,,,,,,,,,
2019,4,Total Nacional,11110300,"Gaseosa Y Otros Refrescos  En Establecimientos De Servicio A La Mesa Y Autoservicio,  Medios De Transporte, Maquinas Expendedoras, Puestos Moviles, Y Lugares De Esparcimiento; Se Incluyen Tambien Las Adquiriudas Para Llevar Y Servicio A Domicilio",103.68,0.74,3.68,nd,0.0,0.01,nd,,,,,,,,,,,,
2019,4,Total Nacional,11110400,"Comidas preparadas fuera del hogar para consumo inmediato, en establecimientos de servicio a la mesa y autoservicio,  puestos móviles, lugares de esparcimiento, para llevar y por servicio a domicilio",101.65,0.34,1.65,2.93,0.01,0.03,nd,,,,,,,,,,,,
2019,4,Total Nacional,11110700,"Gastos en discotecas, bares, griles, tabernas, fondas y tiendas dentro y  al aire libre (comida, bebidas, cover)",103.13,0.43,3.13,nd,0.0,0.01,nd,,,,,,,,,,,,
2019,4,Total Nacional,11120100,Pago Por Alimentación En Comedores,104.01,0.0,4.01,nd,0.0,0.0,nd,,,,,,,,,,,,
2019,4,Total Nacional,11210100,"Servicios de alojamiento en hoteles, pensiones, posadas, hostales y moteles; alojamiento en centros de vacaciones y por motivo de enseñanza: internados",98.88,-0.1,-1.12,nd,0.0,0.0,nd,,,,,,,,,,,,
2019,4,Total Nacional,12110100,Servicios Prestados En Salones De Peluquería Y Establecimientos De Cuidado Personal,102.74,0.06,2.74,4.15,0.0,0.02,nd,,,,,,,,,,,,
2019,4,Total Nacional,12120100,Aparatos Eléctricos Para El Cuidado Personal Y Su Reparación,101.39,0.69,1.39,nd,0.0,0.0,nd,,,,,,,,,,,,
2019,4,Total Nacional,12130100,Artículos Para El Cuidado Y La Atención Personal,100.52,0.61,0.52,1.58,0.0,0.0,nd,,,,,,,,,,,,
2019,4,Total Nacional,12130200,Artículos Para Higiene Corporal,102.23,0.59,2.23,3.01,0.01,0.03,nd,,,,,,,,,,,,
2019,4,Total Nacional,12130300,Artículos Para La Higiene Oral,100.31,0.15,0.31,1.58,0.0,0.0,nd,,,,,,,,,,,,
2019,4,Total Nacional,12130400,Productos De Belleza,100.2,0.17,0.2,0.96,0.0,0.0,nd,,,,,,,,,,,,
2019,4,Total Nacional,12139900,Otros Productos Para El Aseo Personal,101.12,0.07,1.12,nd,0.0,0.01,nd,,,,,,,,,,,,
2019,4,Total Nacional,12310100,"Artículos En Oro,  Plata Y Piedras Preciosas Y Su Reparación",101.58,0.31,1.58,0.66,0.0,0.0,nd,,,,,,,,,,,,
2019,4,Total Nacional,12310200,"Relojes, Cronómetros, Termómetros, Barómetros Y Su Reparación",99.38,0.36,-0.62,0.3,0.0,0.0,nd,,,,,,,,,,,,
2019,4,Total Nacional,12310300,Artículos De Fantasía Y Su Reparación,99.83,0.35,-0.17,nd,0.0,0.0,nd,,,,,,,,,,,,
2019,4,Total Nacional,12320100,Artículos De Viaje Y Otros Artículos Para El Transporte De Efectos Personales,99.58,0.02,-0.42,-0.41,0.0,0.0,nd,,,,,,,,,,,,
2019,4,Total Nacional,12320200,Artículos Para Bebés Y Su Reparación,100.21,0.28,0.21,nd,0.0,0.0,nd,,,,,,,,,,,,
2019,4,Total Nacional,12320400,"Artículos personales varios como: gafas de sol, lentes de contacto cosméticos, bastones, paraguas y sombrillas, abanicos, llaveros, etc.",101.4,0.14,1.4,nd,0.0,0.0,nd,,,,,,,,,,,,
2019,4,Total Nacional,12410100,Servicios de protección social dentro y fuera del hogar,100.06,0.12,0.06,nd,0.0,0.0,nd,,,,,,,,,,,,
2019,4,Total Nacional,12410200,"Guarderías, salacunas, cuidado de niños fuera del hogar y servicios de adopción",105.22,0.07,5.22,nd,0.0,0.01,nd,,,,,,,,,,,,
2019,4,Total Nacional,12410300,Cuotas moderadoras a EPS,106.17,0.0,6.17,6.17,0.0,0.0,nd,,,,,,,,,,,,
2019,4,Total Nacional,12530100,"Seguros médicos, de accidentes y medicina prepagada",106.58,0.96,6.58,7.57,0.0,0.01,nd,,,,,,,,,,,,
2019,4,Total Nacional,12540100,Seguros De Vehículos Y Otros Relacionados Con El Transporte,99.5,0.57,-0.5,-5.84,0.0,0.0,nd,,,,,,,,,,,,
2019,4,Total Nacional,12620400,Servicios auxiliares y  financieros prestados a cambio de una comisión explicita,102.91,0.0,2.91,nd,0.0,0.0,nd,,,,,,,,,,,,
2019,4,Total Nacional,12710500,"Certificados, documentos administrativos y pago de honorarios",101.69,1.69,1.69,nd,0.0,0.0,nd,,,,,,,,,,,,
2019,4,Total Nacional,12719900,Otros pagos por servicios,101.12,0.16,1.12,nd,0.0,0.0,nd,,,,,,,,,,,,
2019,7,Total IPC,01110100,Arroz,108.95,2.17,8.95,8.38,0.02,0.08,nd,,,,,,,,,,,,
2019,7,Total IPC,01110200,Pastas Alimenticias,101.19,-0.16,1.19,1.44,0.0,0.0,nd,,,,,,,,,,,,
2019,7,Total IPC,01110300,Avena Y Sus Derivados,95.92,0.14,-4.08,-4.26,0.0,0.0,nd,,,,,,,,,,,,
2019,7,Total IPC,01110500,Trigo Y Sus Derivados,103.09,0.79,3.09,2.73,0.0,0.0,nd,,,,,,,,,,,,
2019,7,Total IPC,01110600,Maíz Y Sus Derivados,104.77,0.46,4.77,4.41,0.0,0.0,nd,,,,,,,,,,,,
2019,7,Total IPC,01110800,Pan,102.87,0.4,2.87,3.29,0.0,0.02,nd,,,,,,,,,,,,
2019,7,Total IPC,01119800,"Otras Harinas, Cereales Y Almidones",101.54,-0.18,1.54,1.59,0.0,0.0,nd,,,,,,,,,,,,
2019,7,Total IPC,01119900,Otros Productos De Panadería,100.39,-0.19,0.39,1.04,0.0,0.0,nd,,,,,,,,,,,,
2019,7,Total IPC,01120100,Carne De Res Y Derivados,103.96,-0.22,3.96,3.51,0.0,0.07,nd,,,,,,,,,,,,
2019,7,Total IPC,01120200,Carne De Cerdo Y Derivados,100.89,-0.36,0.89,1.86,0.0,0.0,nd,,,,,,,,,,,,
2019,7,Total IPC,01120300,Carne De Aves,102.09,0.3,2.09,2.51,0.0,0.03,nd,,,,,,,,,,,,
2019,7,Total IPC,01120500,"Carnes Preparadas, Charcutería Y Otros Productos Conteniendo Carne",101.0,0.4,1.0,2.49,0.0,0.0,nd,,,,,,,,,,,,
2019,7,Total IPC,01130300,Productos de rio y mar (incluye pescados y camarones frescos o congelados y pescado enlatado como sardinas y atún),103.89,0.56,3.89,5.91,0.0,0.02,nd,,,,,,,,,,,,
2019,7,Total IPC,01140100,Leche,101.96,0.04,1.96,1.77,0.0,0.02,nd,,,,,,,,,,,,
2019,7,Total IPC,01140200,Quesos Y Productos Afines,102.14,-0.31,2.14,4.41,0.0,0.01,nd,,,,,,,,,,,,
